### ISSUE TITLE
esp32s3的webrtc-whip历程，DTLS连接一直不成功

### ISSUE THREAD

**Issue by Yvyang-1** [espressif/esp-webrtc-solution#157]
### Checklist

- [x] Checked the issue tracker for similar issues to ensure this is not a duplicate.
- [x] Provided a clear description of your suggestion.
- [x] Included any relevant context or examples.

### Issue or Suggestion Description

I (8557) NETWORK: got ip:192.168.10.59
E (8557) webrtc: ICE info not fetched yet
I (8567) DTLS: Init SRTP OK
I (9647) webrtc: peer_connection_task started
I (9647) webrtc: PeerConnectionState: 2
I (9647) AGENT: Start agent as Controlling
Add audio codec 9 sample_rate 0
I (9657) webrtc: Send client sdp: v=0
o=- 7801614086411001801 2 IN IP4 0.0.0.0
s=-
t=0 0
a=msid-semantic: esp-webrtc
a=group:BUNDLE 0 1
m=audio 9 UDP/TLS/RTP/SAVP 111
a=rtpmap:111 opus/48000/2
a=ssrc:6 cname:webrtc-opus
a=ssrc:6 msid:esp_stream a0
a=sendrecv
a=mid:0
a=msid:esp_stream a0
c=IN IP4 0.0.0.0
a=rtcp-mux
a=fingerprint:sha-256 BB:4B:E3:CB:81:5D:99:8C:FE:68:53:58:E2:C5:8F:60:67:4C:82:95:91:4C:8E:C9:88:71:89:F3:16:4F:B4:50
a=setup:passive
a=ice-ufrag:Xd4P
a=ice-pwd:oKWwUlPd9ZwfQgpeN3WiStdY
a=candidate:0 1 UDP 2130253311 192.168.10.59 63765 typ host
m=video 9 UDP/TLS/RTP/SAVPF 102 106
a=rtpmap:102 H264/90000
a=rtcp-fb:102 goog-remb
a=rtcp-fb:102 transport-cc
a=rtcp-fb:102 ccm fir
a=rtcp-fb:102 nack
a=rtcp-fb:102 nack pli
a=fmtp:102 level-asymmetry-allowed=1
a=rtpmap:106 H264/90000
a=rtcp-fb:106 goog-remb
a=rtcp-fb:106 transport-cc
a=rtcp-fb:106 ccm fir
a=rtcp-fb:106 nack
a=rtcp-fb:106 nack pli
a=fmtp:106 level-asymmetry-allowed=1;packetization-mode=1;profile-level-id=4d001f
a=ssrc:1 cname:webrtc-h264
a=ssrc:1 msid:esp_stream v0
a=sendrecv
a=mid:1
a=msid:esp_stream v0
c=IN IP4 0.0.0.0
a=rtcp-mux
a=fingerprint:sha-256 BB:4B:E3:CB:81:5D:99:8C:FE:68:53:58:E2:C5:8F:60:67:4C:82:95:91:4C:8E:C9:88:71:89:F3:16:4F:B4:50
a=setup:passive
a=ice-ufrag:Xd4P
a=ice-pwd:oKWwUlPd9ZwfQgpeN3WiStdY
a=candidate:0 1 UDP 2130253311 192.168.10.59 63765 typ host

I (9837) wifi:<ba-add>idx:1 (ifx:0, b4:7c:a6:22:63:6c), tid:5, ssn:1, winSize:64
I (9927) esp-x509-crt-bundle: Certificate validated
Connection --> Close
Content-Type --> application/sdp
Location --> /rtc/v1/whip/?action=delete&token=h0p825619&app=ygc&stream=test&session=mkicy833:Xd4P
Content-Length --> 1214
Server --> SRS/5.0.213(Bee)
Get remote SDP v=0
o=SRS/5.0.213(Bee) 140002647140912 2 IN IP4 0.0.0.0
s=SRSPublishSession
t=0 0
a=ice-lite
a=group:BUNDLE 0 1
a=msid-semantic: WMS ygc/test
m=audio 9 UDP/TLS/RTP/SAVPF 111
c=IN IP4 0.0.0.0
a=ice-ufrag:mkicy833
a=ice-pwd:nz5aqy0q99n27m9294m6i1083h1p575s
a=fingerprint:sha-256 88:98:E0:5D:7C:78:04:DD:23:19:27:F2:6F:82:72:12:8B:3A:7E:87:6D:B3:61:A7:17:42:BB:79:EF:54:A4:F6
a=setup:active
a=mid:0
a=recvonly
a=rtcp-mux
a=rtcp-rsize
a=rtpmap:111 opus/48000/2
a=candidate:0 1 udp 2130706431 172.19.0.2 8000 typ host generation 0
a=candidate:1 1 udp 2130706431 42.193.104.192 8000 typ host generation 0
m=video 9 UDP/TLS/RTP/SAVPF 106
c=IN IP4 0.0.0.0
a=ice-ufrag:mkicy833
a=ice-pwd:nz5aqy0q99n27m9294m6i1083h1p575s
a=fingerprint:sha-256 88:98:E0:5D:7C:78:04:DD:23:19:27:F2:6F:82:72:12:8B:3A:7E:87:6D:B3:61:A7:17:42:BB:79:EF:54:A4:F6
a=setup:active
a=mid:1
a=recvonly
a=rtcp-mux
a=rtcp-rsize
a=rtpmap:106 H264/90000
a=rtcp-fb:106 nack
a=rtcp-fb:106 nack pli
a=fmtp:106 level-asymmetry-allowed=1;packetization-mode=1;profile-level-id=4d001f   
a=candidate:0 1 udp 2130706431 172.19.0.2 8000 typ host generation 0
a=candidate:1 1 udp 2130706431 42.193.104.192 8000 typ host generation 0
4<
I (10687) HTTPS_CLIENT: HTTP Status = 201, content_length = 1214
I (10687) PEER_DEF: Get peer role 0
I (10697) PEER_DEF: Get peer role 0
I (10697) PEER_DEF: Select H264 106
I (10697) AGENT: 0 Add remote type:1 172.19.0.2:8000
I (10697) AGENT: 0 Add remote type:1 42.193.104.192:8000
I (10707) AGENT: 0 Sorted pair 0 type: 1 local:192.168.10.59:63765 Remote:172.19.0.2:8000
I (10717) AGENT: 0 Sorted pair 1 type: 1 local:192.168.10.59:63765 Remote:42.193.104.192:8000
I (10717) webrtc: PeerConnectionState: 3
I (10727) webrtc: PeerConnectionState: 3
I (10737) AGENT: 0 Send binding request (cand:0) local:192.168.10.59:63765 remote:172.19.0.2:8000 id:7043bfa4398150e937521657
I (10737) AGENT: 0 Send binding request (cand:0) local:192.168.10.59:63765 remote:42.193.104.192:8000 id:4d9a2fdb76c3625e55075020
I (10777) AGENT: 0 Select pair42.193.104.192:8000
I (10777) AGENT: 0 Send binding request (cand:1) local:192.168.10.59:63765 remote:42.193.104.192:8000 id:329b54fb381fc0385378d5a8
I (10817) AGENT: 0 Candidate responsed
I (11307) AGENT: 0 Send binding request (cand:1) local:192.168.10.59:63765 remote:42.193.104.192:8000 id:76e5004e797d87a62756c714
I (11867) AGENT: 0 Send binding request (cand:1) local:192.168.10.59:63765 remote:42.193.104.192:8000 id:4c598d93643bd7252b449456
I (12337) AGENT: 0 Send binding request (cand:1) local:192.168.10.59:63765 remote:42.193.104.192:8000 id:671286247899e644088232df
I (12877) AGENT: 0 Send binding request (cand:1) local:192.168.10.59:63765 remote:42.193.104.192:8000 id:6db505597d157d8d71dfed43
I (13077) webrtc: PeerConnectionState: 7
这是设备端的日志输出，设备是passive，服务器一直在发送dtls数据，但是设备一直没回复导致连接超时，最后推流失败了。
[2026-03-03 06:18:48.957][WARN][1][21993407][104] client disconnect peer. ret=1007
[2026-03-03 06:18:48.957][INFO][1][s3dq2578] TCP: clear zombies=1 resources, conns=1, removing=0, unsubs=0
[2026-03-03 06:18:48.957][INFO][1][21993407] TCP: disposing #0 resource(HttpsConn)(0x7f54e80ff200), conns=1, disposing=1, zombies=0
[2026-03-03 06:18:50.009][INFO][1][6851q78b] https: stream server done, use key /usr/local/srs/conf/certs/api.zhongkerobot.com.key and cert /usr/local/srs/conf/certs/api.zhongkerobot.com.pem, cost=362ms
[2026-03-03 06:18:50.033][INFO][1][6851q78b] HTTP #0 36.143.177.190:14076 POST https://api.zhongkerobot.com:8443/rtc/v1/whip/?app=ygc&stream=test, content-length=1377
[2026-03-03 06:18:50.099][INFO][1][6851q78b] RTC whip publish /ygc/test, clientip=36.143.177.190, app=ygc, stream=test, offer=1377B, eip=, codec=, srtp=, dtls=, ufrag=, pwd=, param=app=ygc&stream=test
[2026-03-03 06:18:50.099][INFO][1][6851q78b] ignore attribute=candidate, value=0 1 UDP 2127255039 192.168.10.59 52053 typ host
[2026-03-03 06:18:50.099][INFO][1][6851q78b] ignore attribute=candidate, value=0 1 UDP 2127255039 192.168.10.59 52053 typ host
[2026-03-03 06:18:50.099][WARN][1][6851q78b][0] not ideal H.264 pt=106 level-asymmetry-allowed=1;packetization-mode=1;profile-level-id=4d001f
[2026-03-03 06:18:50.100][INFO][1][6851q78b] RTC publisher nack=1, nnc=1, pt-drop=0, twcc=0/0
[2026-03-03 06:18:50.100][INFO][1][6851q78b] RTC: Init tracks {track: v0, is_active: 0=>1},{track: a0, is_active: 0=>1}, ok
[2026-03-03 06:18:50.114][INFO][1][6851q78b] Best matched ip=172.19.0.2, ifname=eth0
[2026-03-03 06:18:50.114][INFO][1][6851q78b] RTC: Use candidates 172.19.0.2, 42.193.104.192, protocol=udp
[2026-03-03 06:18:50.114][INFO][1][6851q78b] RTC init session, user=2z2h3760:Xd4P, url=/ygc/test, encrypt=1/1, DTLS(role=active, version=auto), timeout=30000ms, nack=1
[2026-03-03 06:18:50.145][INFO][1][6851q78b] https: connected to https://api.zhongkerobot.com:443, cost=13ms
[2026-03-03 06:18:50.152][INFO][1][6851q78b] http: on_publish ok, client_id=6851q78b, url=https://api.zhongkerobot.com/srs_on_publish, request={"server_id":"vid-o32739b","service_id":"2jj9t897","action":"on_publish","client_id":"6851q78b","ip":"36.143.177.190","vhost":"__defaultVhost__","app":"ygc","tcUrl":"","stream":"test","param":"app=ygc&stream=test","stream_url":"/ygc/test","stream_id":"vid-00ix565"}, response={"code":0,"msg":"ok"}
[2026-03-03 06:18:50.153][INFO][1][6851q78b] RTC username=2z2h3760:Xd4P, offer=1377B, answer=1286B
[2026-03-03 06:18:50.153][INFO][1][6851q78b] RTC remote offer: v=0\r\no=- 7801614086411001801 2 IN IP4 0.0.0.0\r\ns=-\r\nt=0 0\r\na=msid-semantic: esp-webrtc\r\na=group:BUNDLE 0 1\r\nm=audio 9 UDP/TLS/RTP/SAVP 111\r\na=rtpmap:111 opus/48000/2\r\na=ssrc:6 cname:webrtc-opus\r\na=ssrc:6 msid:esp_stream a0\r\na=sendrecv\r\na=mid:0\r\na=msid:esp_stream a0\r\nc=IN IP4 0.0.0.0\r\na=rtcp-mux\r\na=fingerprint:sha-256 13:31:F6:5B:AE:5D:44:6C:FA:28:D7:E0:73:AD:EE:13:7B:7A:E3:F7:DA:40:DC:65:21:52:18:7A:53:AD:89:47\r\na=setup:passive\r\na=ice-ufrag:Xd4P\r\na=ice-pwd:oKWwUlPd9ZwfQgpeN3WiStdY\r\na=candidate:0 1 UDP 2127255039 192.168.10.59 52053 typ host\r\nm=video 9 UDP/TLS/RTP/SAVPF 102 106\r\na=rtpmap:102 H264/90000\r\na=rtcp-fb:102 goog-remb\r\na=rtcp-fb:102 transport-cc\r\na=rtcp-fb:102 ccm fir\r\na=rtcp-fb:102 nack\r\na=rtcp-fb:102 nack pli\r\na=fmtp:102 level-asymmetry-allowed=1\r\na=rtpmap:106 H264/90000\r\na=rtcp-fb:106 goog-remb\r\na=rtcp-fb:106 transport-cc\r\na=rtcp-fb:106 ccm fir\r\na=rtcp-fb:106 nack\r\na=rtcp-fb:106 nack pli\r\na=fmtp:106 level-asymmetry-allowed=1;packetization-mode=1;profile-level-id=4d001f\r\na=ssrc:1 cname:webrtc-h264\r\na=ssrc:1 msid:esp_stream v0\r\na=sendrecv\r\na=mid:1\r\na=msid:esp_stream v0\r\nc=IN IP4 0.0.0.0\r\na=rtcp-mux\r\na=fingerprint:sha-256 13:31:F6:5B:AE:5D:44:6C:FA:28:D7:E0:73:AD:EE:13:7B:7A:E3:F7:DA:40:DC:65:21:52:18:7A:53:AD:89:47\r\na=setup:passive\r\na=ice-ufrag:Xd4P\r\na=ice-pwd:oKWwUlPd9ZwfQgpeN3WiStdY\r\na=candidate:0 1 UDP 2127255039 192.168.10.59 52053 typ host\r\n
[2026-03-03 06:18:50.153][INFO][1][6851q78b] RTC local answer: v=0\r\no=SRS/5.0.213(Bee) 140002647140912 2 IN IP4 0.0.0.0\r\ns=SRSPublishSession\r\nt=0 0\r\na=ice-lite\r\na=group:BUNDLE 0 1\r\na=msid-semantic: WMS ygc/test\r\nm=audio 9 UDP/TLS/RTP/SAVPF 111\r\nc=IN IP4 0.0.0.0\r\na=ice-ufrag:2z2h3760\r\na=ice-pwd:917d9oz460o6ys61456519479kp79b88\r\na=fingerprint:sha-256 88:98:E0:5D:7C:78:04:DD:23:19:27:F2:6F:82:72:12:8B:3A:7E:87:6D:B3:61:A7:17:42:BB:79:EF:54:A4:F6\r\na=setup:active\r\na=mid:0\r\na=recvonly\r\na=rtcp-mux\r\na=rtcp-rsize\r\na=rtpmap:111 opus/48000/2\r\na=candidate:0 1 udp 2130706431 172.19.0.2 8000 typ host generation 0\r\na=candidate:1 1 udp 2130706431 42.193.104.192 8000 typ host generation 0\r\nm=video 9 UDP/TLS/RTP/SAVPF 106\r\nc=IN IP4 0.0.0.0\r\na=ice-ufrag:2z2h3760\r\na=ice-pwd:917d9oz460o6ys61456519479kp79b88\r\na=fingerprint:sha-256 88:98:E0:5D:7C:78:04:DD:23:19:27:F2:6F:82:72:12:8B:3A:7E:87:6D:B3:61:A7:17:42:BB:79:EF:54:A4:F6\r\na=setup:active\r\na=mid:1\r\na=recvonly\r\na=rtcp-mux\r\na=rtcp-rsize\r\na=rtpmap:106 H264/90000\r\na=rtcp-fb:106 nack\r\na=rtcp-fb:106 nack pli\r\na=fmtp:106 level-asymmetry-allowed=1;packetization-mode=1;profile-level-id=4d001f\r\na=candidate:0 1 udp 2130706431 172.19.0.2 8000 typ host generation 0\r\na=candidate:1 1 udp 2130706431 42.193.104.192 8000 typ host generation 0\r\n
[2026-03-03 06:18:50.493][INFO][1][6851q78b] TCP: before dispose resource(HttpsConn)(0x7f54e81d6410), conns=1, zombies=0, ign=0, inz=0, ind=0
[2026-03-03 06:18:50.494][WARN][1][6851q78b][104] client disconnect peer. ret=1007
[2026-03-03 06:18:50.494][INFO][1][s3dq2578] TCP: clear zombies=1 resources, conns=1, removing=0, unsubs=0
[2026-03-03 06:18:50.494][INFO][1][6851q78b] TCP: disposing #0 resource(HttpsConn)(0x7f54e81d6410), conns=1, disposing=1, zombies=0
[2026-03-03 06:18:50.574][INFO][1][6851q78b] RTC: session address init 36.143.177.190:14083
[2026-03-03 06:18:50.574][INFO][1][6851q78b] RTC: session STUN done, waiting DTLS handshake.
[2026-03-03 06:18:50.574][INFO][1][6851q78b] DTLS: State Active SEND, done=0, arq=0, r0=0, len=312, cnt=22, size=299, hs=1
[2026-03-03 06:18:50.574][INFO][1][588e6888] <- RTC RECV #12, udp 7, pps 0/0, schedule 7
[2026-03-03 06:18:50.625][INFO][1][6851q78b] DTLS: State Active SEND, done=0, arq=1, r0=0, len=312, cnt=22, size=299, hs=1
[2026-03-03 06:18:50.726][INFO][1][6851q78b] DTLS: State Active SEND, done=0, arq=2, r0=0, len=312, cnt=22, size=299, hs=1
[2026-03-03 06:18:50.926][INFO][1][6851q78b] DTLS: State Active SEND, done=0, arq=3, r0=0, len=312, cnt=22, size=299, hs=1
[2026-03-03 06:18:51.099][INFO][1][2323p931] Hybrid cpu=1.00%,8MB, cid=7,2, timer=62,1,3, clock=0,48,1,0,0,0,1,0,0, free=1
[2026-03-03 06:18:51.099][INFO][1][2323p931] RTC: Server conns=1, rpkts=(1,rtp:0,stun:1,rtcp:0), spkts=(1,rtp:0,stun:1,rtcp:0), snk=(11,a:5,v:5,h:0), fid=(id:1,fid:1,ffid:0,addr:1,faddr:1)
[2026-03-03 06:18:51.327][INFO][1][6851q78b] DTLS: State Active SEND, done=0, arq=4, r0=0, len=312, cnt=22, size=299, hs=1
[2026-03-03 06:18:52.127][INFO][1][6851q78b] DTLS: State Active SEND, done=0, arq=5, r0=0, len=312, cnt=22, size=299, hs=1
[2026-03-03 06:18:52.843][INFO][1][923j6626] https: stream server done, use key /usr/local/srs/conf/certs/api.zhongkerobot.com.key and cert /usr/local/srs/conf/certs/api.zhongkerobot.com.pem, cost=17ms
[2026-03-03 06:18:52.857][INFO][1][923j6626] HTTP #0 36.143.177.190:14175 GET https://api.zhongkerobot.com:8443/api/v1/vhosts/?callback=angular.callbacks._7r, content-length=-1
[2026-03-03 06:18:52.932][INFO][1][923j6626] TCP: before dispose resource(HttpsConn)(0x7f54e8363dd0), conns=1, zombies=0, ign=0, inz=0, ind=0
[2026-03-03 06:18:52.932][WARN][1][923j6626][104] client disconnect peer. ret=1007
[2026-03-03 06:18:52.932][INFO][1][s3dq2578] TCP: clear zombies=1 resources, conns=1, removing=0, unsubs=0
[2026-03-03 06:18:52.932][INFO][1][923j6626] TCP: disposing #0 resource(HttpsConn)(0x7f54e8363dd0), conns=1, disposing=1, zombies=0
[2026-03-03 06:18:53.695][INFO][1][7b065691] Process: cpu=1.00%,8MB, threads=2
[2026-03-03 06:18:53.728][INFO][1][6851q78b] DTLS: State Active SEND, done=0, arq=6, r0=0, len=312, cnt=22, size=299, hs=1
[2026-03-03 06:18:56.100][INFO][1][2323p931] Hybrid cpu=1.00%,8MB, cid=7,2, timer=62,1,3, clock=0,48,1,0,0,0,1,0,0, free=1
[2026-03-03 06:18:56.100][INFO][1][2323p931] RTC: Server conns=1, rpkts=(1,rtp:0,stun:1,rtcp:0), spkts=(1,rtp:0,stun:1,rtcp:0), snk=(11,a:5,v:5,h:0), fid=(id:1,fid:1,ffid:0,addr:1,faddr:1)
[2026-03-03 06:18:56.853][INFO][1][59g7x49x] https: stream server done, use key /usr/local/srs/conf/certs/api.zhongkerobot.com.key and cert /usr/local/srs/conf/certs/api.zhongkerobot.com.pem, cost=21ms
[2026-03-03 06:18:56.869][INFO][1][59g7x49x] HTTP #0 36.143.177.190:14233 GET https://api.zhongkerobot.com:8443/api/v1/vhosts/?callback=angular.callbacks._7s, content-length=-1
[2026-03-03 06:18:56.929][INFO][1][6851q78b] DTLS: State Active SEND, done=0, arq=7, r0=0, len=312, cnt=22, size=299, hs=1
[2026-03-03 06:18:56.954][INFO][1][59g7x49x] TCP: before dispose resource(HttpsConn)(0x7f54e8046040), conns=1, zombies=0, ign=0, inz=0, ind=0
[2026-03-03 06:18:56.954][WARN][1][59g7x49x][104] client disconnect peer. ret=1007
[2026-03-03 06:18:56.954][INFO][1][s3dq2578] TCP: clear zombies=1 resources, conns=1, removing=0, unsubs=0
[2026-03-03 06:18:56.954][INFO][1][59g7x49x] TCP: disposing #0 resource(HttpsConn)(0x7f54e8046040), conns=1, disposing=1, zombies=0
[2026-03-03 06:18:58.697][INFO][1][7b065691] Process: cpu=1.00%,8MB, threads=2
[2026-03-03 06:19:00.859][INFO][1][616d76v7] https: stream server done, use key /usr/local/srs/conf/certs/api.zhongkerobot.com.key and cert /usr/local/srs/conf/certs/api.zhongkerobot.com.pem, cost=22ms
[2026-03-03 06:19:00.879][INFO][1][616d76v7] HTTP #0 36.143.177.190:13832 GET https://api.zhongkerobot.com:8443/api/v1/vhosts/?callback=angular.callbacks._7t, content-length=-1
[2026-03-03 06:19:00.969][INFO][1][616d76v7] TCP: before dispose resource(HttpsConn)(0x7f54e80a49b0), conns=1, zombies=0, ign=0, inz=0, ind=0
[2026-03-03 06:19:00.969][WARN][1][616d76v7][104] client disconnect peer. ret=1007
[2026-03-03 06:19:00.969][INFO][1][s3dq2578] TCP: clear zombies=1 resources, conns=1, removing=0, unsubs=0
[2026-03-03 06:19:00.969][INFO][1][616d76v7] TCP: disposing #0 resource(HttpsConn)(0x7f54e80a49b0), conns=1, disposing=1, zombies=0
[2026-03-03 06:19:01.100][INFO][1][2323p931] Hybrid cpu=1.00%,8MB, cid=7,2, timer=62,1,3, clock=0,48,1,0,0,0,1,0,0, free=1
[2026-03-03 06:19:01.100][INFO][1][2323p931] RTC: Server conns=1, rpkts=(1,rtp:0,stun:1,rtcp:0), spkts=(1,rtp:0,stun:1,rtcp:0), snk=(11,a:5,v:5,h:0), fid=(id:1,fid:1,ffid:0,addr:1,faddr:1)
[2026-03-03 06:19:03.329][INFO][1][6851q78b] DTLS: State Active SEND, done=0, arq=8, r0=0, len=312, cnt=22, size=299, hs=1
[2026-03-03 06:19:03.701][INFO][1][7b065691] Process: cpu=1.00%,8MB, threads=2
[2026-03-03 06:19:04.833][INFO][1][26jp366j] https: stream server done, use key /usr/local/srs/conf/certs/api.zhongkerobot.com.key and cert /usr/local/srs/conf/certs/api.zhongkerobot.com.pem, cost=14ms
[2026-03-03 06:19:04.845][INFO][1][26jp366j] HTTP #0 36.143.177.190:13877 GET https://api.zhongkerobot.com:8443/api/v1/vhosts/?callback=angular.callbacks._7u, content-length=-1
[2026-03-03 06:19:04.909][INFO][1][26jp366j] TCP: before dispose resource(HttpsConn)(0x7f54e82b9e90), conns=1, zombies=0, ign=0, inz=0, ind=0
[2026-03-03 06:19:04.909][WARN][1][26jp366j][104] client disconnect peer. ret=1007
[2026-03-03 06:19:04.909][INFO][1][s3dq2578] TCP: clear zombies=1 resources, conns=1, removing=0, unsubs=0
[2026-03-03 06:19:04.909][INFO][1][26jp366j] TCP: disposing #0 resource(HttpsConn)(0x7f54e82b9e90), conns=1, disposing=1, zombies=0
[2026-03-03 06:19:06.100][INFO][1][2323p931] Hybrid cpu=0.00%,8MB, cid=4,2, timer=62,10,48, clock=0,47,1,0,0,0,0,0,0, free=1
[2026-03-03 06:19:06.100][INFO][1][2323p931] RTC: Server conns=1, rpkts=(1,rtp:0,stun:1,rtcp:0), spkts=(1,rtp:0,stun:1,rtcp:0), snk=(97,a:48,v:48,h:0), fid=(id:0,fid:1,ffid:0,addr:1,faddr:1)
[2026-03-03 06:19:08.704][INFO][1][7b065691] Process: cpu=1.00%,8MB, threads=2
[2026-03-03 06:19:08.840][INFO][1][tf255467] https: stream server done, use key /usr/local/srs/conf/certs/api.zhongkerobot.com.key and cert /usr/local/srs/conf/certs/api.zhongkerobot.com.pem, cost=15ms
[2026-03-03 06:19:08.853][INFO][1][tf255467] HTTP #0 36.143.177.190:13938 GET https://api.zhongkerobot.com:8443/api/v1/vhosts/?callback=angular.callbacks._7v, content-length=-1
[2026-03-03 06:19:08.917][INFO][1][tf255467] TCP: before dispose resource(HttpsConn)(0x7f54e81d66b0), conns=1, zombies=0, ign=0, inz=0, ind=0
[2026-03-03 06:19:08.917][WARN][1][tf255467][104] client disconnect peer. ret=1007
[2026-03-03 06:19:08.917][INFO][1][s3dq2578] TCP: clear zombies=1 resources, conns=1, removing=0, unsubs=0
[2026-03-03 06:19:08.917][INFO][1][tf255467] TCP: disposing #0 resource(HttpsConn)(0x7f54e81d66b0), conns=1, disposing=1, zombies=0
[2026-03-03 06:19:11.101][INFO][1][2323p931] Hybrid cpu=1.00%,8MB, cid=4,2, timer=62,10,48, clock=0,47,1,0,0,0,0,0,0, free=1
[2026-03-03 06:19:11.101][INFO][1][2323p931] RTC: Server conns=1, rpkts=(1,rtp:0,stun:1,rtcp:0), spkts=(1,rtp:0,stun:1,rtcp:0), snk=(97,a:48,v:48,h:0), fid=(id:0,fid:1,ffid:0,addr:1,faddr:1)
[2026-03-03 06:19:12.855][INFO][1][4241cx4j] https: stream server done, use key /usr/local/srs/conf/certs/api.zhongkerobot.com.key and cert /usr/local/srs/conf/certs/api.zhongkerobot.com.pem, cost=21ms
[2026-03-03 06:19:12.873][INFO][1][4241cx4j] HTTP #0 36.143.177.190:13972 GET https://api.zhongkerobot.com:8443/api/v1/vhosts/?callback=angular.callbacks._7w, content-length=-1
[2026-03-03 06:19:12.953][INFO][1][4241cx4j] TCP: before dispose resource(HttpsConn)(0x7f54e811ef20), conns=1, zombies=0, ign=0, inz=0, ind=0
[2026-03-03 06:19:12.953][WARN][1][4241cx4j][104] client disconnect peer. ret=1007
[2026-03-03 06:19:12.953][INFO][1][s3dq2578] TCP: clear zombies=1 resources, conns=1, removing=0, unsubs=0
[2026-03-03 06:19:12.953][INFO][1][4241cx4j] TCP: disposing #0 resource(HttpsConn)(0x7f54e811ef20), conns=1, disposing=1, zombies=0
[2026-03-03 06:19:13.707][INFO][1][7b065691] Process: cpu=0.00%,8MB, threads=2
[2026-03-03 06:19:16.102][INFO][1][2323p931] Hybrid cpu=0.00%,8MB, cid=3,1, timer=62,10,48, clock=0,48,1,0,0,0,0,0,0, free=1
[2026-03-03 06:19:16.102][INFO][1][2323p931] RTC: Server conns=1, snk=(97,a:48,v:48,h:0)
[2026-03-03 06:19:16.130][INFO][1][6851q78b] DTLS: State Active SEND, done=0, arq=9, r0=0, len=312, cnt=22, size=299, hs=1
[2026-03-03 06:19:16.841][INFO][1][81cbrn2a] https: stream server done, use key /usr/local/srs/conf/certs/api.zhongkerobot.com.key and cert /usr/local/srs/conf/certs/api.zhongkerobot.com.pem, cost=17ms
[2026-03-03 06:19:16.856][INFO][1][81cbrn2a] HTTP #0 36.143.177.190:13994 GET https://api.zhongkerobot.com:8443/api/v1/vhosts/?callback=angular.callbacks._7x, content-length=-1
[2026-03-03 06:19:16.939][INFO][1][81cbrn2a] TCP: before dispose resource(HttpsConn)(0x7f54e8292ac0), conns=1, zombies=0, ign=0, inz=0, ind=0
[2026-03-03 06:19:16.939][WARN][1][81cbrn2a][104] client disconnect peer. ret=1007
[2026-03-03 06:19:16.939][INFO][1][s3dq2578] TCP: clear zombies=1 resources, conns=1, removing=0, unsubs=0
[2026-03-03 06:19:16.939][INFO][1][81cbrn2a] TCP: disposing #0 resource(HttpsConn)(0x7f54e8292ac0), conns=1, disposing=1, zombies=0
[2026-03-03 06:19:18.710][INFO][1][7b065691] Process: cpu=0.00%,8MB, threads=2
[2026-03-03 06:19:20.837][INFO][1][469dsz6l] https: stream server done, use key /usr/local/srs/conf/certs/api.zhongkerobot.com.key and cert /usr/local/srs/conf/certs/api.zhongkerobot.com.pem, cost=15ms
[2026-03-03 06:19:20.848][INFO][1][469dsz6l] HTTP #0 36.143.177.190:14066 GET https://api.zhongkerobot.com:8443/api/v1/vhosts/?callback=angular.callbacks._7y, content-length=-1
[2026-03-03 06:19:20.924][INFO][1][469dsz6l] TCP: before dispose resource(HttpsConn)(0x7f54e830c0d0), conns=1, zombies=0, ign=0, inz=0, ind=0
[2026-03-03 06:19:20.924][WARN][1][469dsz6l][104] client disconnect peer. ret=1007
[2026-03-03 06:19:20.924][INFO][1][s3dq2578] TCP: clear zombies=1 resources, conns=1, removing=0, unsubs=0
[2026-03-03 06:19:20.924][INFO][1][469dsz6l] TCP: disposing #0 resource(HttpsConn)(0x7f54e830c0d0), conns=1, disposing=1, zombies=0
[2026-03-03 06:19:21.102][INFO][1][2323p931] Hybrid cpu=0.00%,8MB, cid=3,1, timer=62,10,48, clock=0,48,1,0,0,0,0,0,0, free=1
[2026-03-03 06:19:21.102][INFO][1][2323p931] RTC: Server conns=1, snk=(97,a:48,v:48,h:0)
这是连接时的SRS服务器的日志输出，可以看到服务器发了9次dtls数据都没收到设备的响应，最后超时断开连接了。之后我又用obs试了一下，obs可以正常推流，所以应该就是esp32设备端的问题。我想知道这是怎么回事？该怎么解决呀？求求了，求大佬指点一下，搞了好几天都没搞明白。

**Comment by TempoTian** [comment]
抓个包看下，同步的把log和抓包文件都发一下我看看。目前从log看是对端没发binding request导致判断连接没成功。
正常需要有下面的log：
```c
                if (agent->stun_state != ICE_CANDIDATE_STATE_SUCCEEDED) {
                    ESP_LOGI(TAG, "%d PeerBinding recv local:" IP_PATTERN " remote:" IP_PATTERN,
                            agent->mode, IP_STR(pair->local->addr, ip_str), IP_STR(pair->remote->addr, &ip_str[64]));
                }
                pair->peer_connected = true;
```

**Comment by Yvyang-1** [comment]
[2026-03-04 03:31:06.119][WARN][1][20147715][104] client disconnect peer. ret=1007
[2026-03-04 03:31:06.119][INFO][1][s3dq2578] TCP: clear zombies=1 resources, conns=1, removing=0, unsubs=0
[2026-03-04 03:31:06.119][INFO][1][20147715] TCP: disposing #0 resource(HttpsConn)(0x7f54e838bac0), conns=1, disposing=1, zombies=0
[2026-03-04 03:31:06.219][INFO][1][20147715] RTC: session address init 36.143.177.190:14126
[2026-03-04 03:31:06.219][INFO][1][20147715] RTC: session STUN done, waiting DTLS handshake.
[2026-03-04 03:31:06.219][INFO][1][20147715] DTLS: State Active SEND, done=0, arq=0, r0=0, len=312, cnt=22, size=299, hs=1
[2026-03-04 03:31:06.219][INFO][1][588e6888] <- RTC RECV #12, udp 8, pps 0/0, schedule 8
[2026-03-04 03:31:06.255][INFO][1][20147715] DTLS: State Active SEND, done=0, arq=1, r0=0, len=312, cnt=22, size=299, hs=1
[2026-03-04 03:31:06.356][INFO][1][20147715] DTLS: State Active SEND, done=0, arq=2, r0=0, len=312, cnt=22, size=299, hs=1
[2026-03-04 03:31:06.556][INFO][1][20147715] DTLS: State Active SEND, done=0, arq=3, r0=0, len=312, cnt=22, size=299, hs=1
[2026-03-04 03:31:06.957][INFO][1][20147715] DTLS: State Active SEND, done=0, arq=4, r0=0, len=312, cnt=22, size=299, hs=1
[2026-03-04 03:31:07.757][INFO][1][20147715] DTLS: State Active SEND, done=0, arq=5, r0=0, len=312, cnt=22, size=299, hs=1
[2026-03-04 03:31:09.358][INFO][1][20147715] DTLS: State Active SEND, done=0, arq=6, r0=0, len=312, cnt=22, size=299, hs=1
[2026-03-04 03:31:09.530][INFO][1][67x1h4ih] https: stream server done, use key /usr/local/srs/conf/certs/api.zhongkerobot.com.key and cert /usr/local/srs/conf/certs/api.zhongkerobot.com.pem, cost=23ms
[2026-03-04 03:31:09.538][INFO][1][7b065691] Process: cpu=0.00%,11MB, threads=2
[2026-03-04 03:31:09.551][INFO][1][67x1h4ih] HTTP #0 36.143.177.190:14188 GET https://api.zhongkerobot.com:8443/api/v1/vhosts/?callback=angular.callbacks._dw, content-length=-1
[2026-03-04 03:31:09.641][INFO][1][67x1h4ih] TCP: before dispose resource(HttpsConn)(0x7f54e8206330), conns=1, zombies=0, ign=0, inz=0, ind=0
[2026-03-04 03:31:09.641][WARN][1][67x1h4ih][104] client disconnect peer. ret=1007
[2026-03-04 03:31:09.641][INFO][1][s3dq2578] TCP: clear zombies=1 resources, conns=1, removing=0, unsubs=0
[2026-03-04 03:31:09.641][INFO][1][67x1h4ih] TCP: disposing #0 resource(HttpsConn)(0x7f54e8206330), conns=1, disposing=1, zombies=0
[2026-03-04 03:31:09.644][INFO][1][2323p931] Hybrid cpu=0.00%,11MB, cid=4,1, timer=62,0,0, clock=0,48,1,0,0,0,0,0,0, free=1
[2026-03-04 03:31:09.644][INFO][1][2323p931] RTC: Server conns=1, rpkts=(1,rtp:0,stun:1,rtcp:0), spkts=(1,rtp:0,stun:1,rtcp:0), snk=(1,a:1,v:1,h:0), fid=(id:1,fid:1,ffid:0,addr:1,faddr:1)
[2026-03-04 03:31:12.559][INFO][1][20147715] DTLS: State Active SEND, done=0, arq=7, r0=0, len=312, cnt=22, size=299, hs=1
[2026-03-04 03:31:13.527][INFO][1][e5q51312] https: stream server done, use key /usr/local/srs/conf/certs/api.zhongkerobot.com.key and cert /usr/local/srs/conf/certs/api.zhongkerobot.com.pem, cost=21ms
[2026-03-04 03:31:13.546][INFO][1][e5q51312] HTTP #0 36.143.177.190:14311 GET https://api.zhongkerobot.com:8443/api/v1/vhosts/?callback=angular.callbacks._dx, content-length=-1
[2026-03-04 03:31:13.633][INFO][1][e5q51312] TCP: before dispose resource(HttpsConn)(0x7f54e821da90), conns=1, zombies=0, ign=0, inz=0, ind=0
[2026-03-04 03:31:13.633][WARN][1][e5q51312][104] client disconnect peer. ret=1007
[2026-03-04 03:31:13.633][INFO][1][s3dq2578] TCP: clear zombies=1 resources, conns=1, removing=0, unsubs=0
[2026-03-04 03:31:13.633][INFO][1][e5q51312] TCP: disposing #0 resource(HttpsConn)(0x7f54e821da90), conns=1, disposing=1, zombies=0
[2026-03-04 03:31:14.541][INFO][1][7b065691] Process: cpu=1.00%,11MB, threads=2
[2026-03-04 03:31:14.645][INFO][1][2323p931] Hybrid cpu=1.00%,11MB, cid=7,2, timer=61,6,28, clock=0,47,1,0,1,0,0,0,1, free=1
[2026-03-04 03:31:14.645][INFO][1][2323p931] RTC: Server conns=1, rpkts=(1,rtp:0,stun:1,rtcp:0), spkts=(1,rtp:0,stun:1,rtcp:0), snk=(1,a:1,v:1,h:0), fid=(id:1,fid:1,ffid:0,addr:1,faddr:1)
[2026-03-04 03:31:17.527][INFO][1][9240wjy4] https: stream server done, use key /usr/local/srs/conf/certs/api.zhongkerobot.com.key and cert /usr/local/srs/conf/certs/api.zhongkerobot.com.pem, cost=21ms
[2026-03-04 03:31:17.545][INFO][1][9240wjy4] HTTP #0 36.143.177.190:13913 GET https://api.zhongkerobot.com:8443/api/v1/vhosts/?callback=angular.callbacks._dy, content-length=-1
[2026-03-04 03:31:17.632][INFO][1][9240wjy4] TCP: before dispose resource(HttpsConn)(0x7f54e8200690), conns=1, zombies=0, ign=0, inz=0, ind=0
[2026-03-04 03:31:17.633][WARN][1][9240wjy4][104] client disconnect peer. ret=1007
[2026-03-04 03:31:17.633][INFO][1][s3dq2578] TCP: clear zombies=1 resources, conns=1, removing=0, unsubs=0
[2026-03-04 03:31:17.633][INFO][1][9240wjy4] TCP: disposing #0 resource(HttpsConn)(0x7f54e8200690), conns=1, disposing=1, zombies=0
[2026-03-04 03:31:18.959][INFO][1][20147715] DTLS: State Active SEND, done=0, arq=8, r0=0, len=312, cnt=22, size=299, hs=1
[2026-03-04 03:31:19.545][INFO][1][7b065691] Process: cpu=1.00%,11MB, threads=2
[2026-03-04 03:31:19.645][INFO][1][2323p931] Hybrid cpu=1.00%,11MB, cid=7,2, timer=61,6,28, clock=0,47,1,0,1,0,0,0,1, free=1
[2026-03-04 03:31:19.645][INFO][1][2323p931] RTC: Server conns=1, rpkts=(1,rtp:0,stun:1,rtcp:0), spkts=(1,rtp:0,stun:1,rtcp:0), snk=(1,a:1,v:1,h:0), fid=(id:1,fid:1,ffid:0,addr:1,faddr:1)
[2026-03-04 03:31:21.512][INFO][1][a8pj8074] https: stream server done, use key /usr/local/srs/conf/certs/api.zhongkerobot.com.key and cert /usr/local/srs/conf/certs/api.zhongkerobot.com.pem, cost=15ms
[2026-03-04 03:31:21.524][INFO][1][a8pj8074] HTTP #0 36.143.177.190:14017 GET https://api.zhongkerobot.com:8443/api/v1/vhosts/?callback=angular.callbacks._dz, content-length=-1
[2026-03-04 03:31:21.597][INFO][1][a8pj8074] TCP: before dispose resource(HttpsConn)(0x7f54e81f57a0), conns=1, zombies=0, ign=0, inz=0, ind=0
[2026-03-04 03:31:21.597][WARN][1][a8pj8074][104] client disconnect peer. ret=1007
[2026-03-04 03:31:21.597][INFO][1][s3dq2578] TCP: clear zombies=1 resources, conns=1, removing=0, unsubs=0
[2026-03-04 03:31:21.597][INFO][1][a8pj8074] TCP: disposing #0 resource(HttpsConn)(0x7f54e81f57a0), conns=1, disposing=1, zombies=0
[2026-03-04 03:31:24.549][INFO][1][7b065691] Process: cpu=1.00%,11MB, threads=2
[2026-03-04 03:31:24.645][INFO][1][2323p931] Hybrid cpu=1.00%,11MB, cid=7,2, timer=61,6,28, clock=0,47,1,0,1,0,0,0,1, free=1
[2026-03-04 03:31:24.646][INFO][1][2323p931] RTC: Server conns=1, spkts=(1,rtp:0,stun:1,rtcp:0), snk=(98,a:49,v:49,h:0)
[2026-03-04 03:31:25.506][INFO][1][n1fkb719] https: stream server done, use key /usr/local/srs/conf/certs/api.zhongkerobot.com.key and cert /usr/local/srs/conf/certs/api.zhongkerobot.com.pem, cost=14ms
[2026-03-04 03:31:25.517][INFO][1][n1fkb719] HTTP #0 36.143.177.190:14057 GET https://api.zhongkerobot.com:8443/api/v1/vhosts/?callback=angular.callbacks._e0, content-length=-1
[2026-03-04 03:31:25.589][INFO][1][n1fkb719] TCP: before dispose resource(HttpsConn)(0x7f54e83aae20), conns=1, zombies=0, ign=0, inz=0, ind=0
[2026-03-04 03:31:25.590][WARN][1][n1fkb719][104] client disconnect peer. ret=1007
[2026-03-04 03:31:25.590][INFO][1][s3dq2578] TCP: clear zombies=1 resources, conns=1, removing=0, unsubs=0
[2026-03-04 03:31:25.590][INFO][1][n1fkb719] TCP: disposing #0 resource(HttpsConn)(0x7f54e83aae20), conns=1, disposing=1, zombies=0
[2026-03-04 03:31:29.519][INFO][1][675d4299] https: stream server done, use key /usr/local/srs/conf/certs/api.zhongkerobot.com.key and cert /usr/local/srs/conf/certs/api.zhongkerobot.com.pem, cost=20ms
[2026-03-04 03:31:29.534][INFO][1][675d4299] HTTP #0 36.143.177.190:14113 GET https://api.zhongkerobot.com:8443/api/v1/vhosts/?callback=angular.callbacks._e1, content-length=-1
[2026-03-04 03:31:29.553][INFO][1][7b065691] Process: cpu=0.00%,11MB, threads=2
[2026-03-04 03:31:29.616][INFO][1][675d4299] TCP: before dispose resource(HttpsConn)(0x7f54e839ed30), conns=1, zombies=0, ign=0, inz=0, ind=0
[2026-03-04 03:31:29.616][WARN][1][675d4299][104] client disconnect peer. ret=1007
[2026-03-04 03:31:29.616][INFO][1][s3dq2578] TCP: clear zombies=1 resources, conns=1, removing=0, unsubs=0
[2026-03-04 03:31:29.616][INFO][1][675d4299] TCP: disposing #0 resource(HttpsConn)(0x7f54e839ed30), conns=1, disposing=1, zombies=0
[2026-03-04 03:31:29.646][INFO][1][2323p931] Hybrid cpu=0.00%,11MB, cid=4,1, timer=62,10,49, clock=0,48,1,0,0,0,0,0,0, free=1
[2026-03-04 03:31:29.646][INFO][1][2323p931] RTC: Server conns=1, spkts=(1,rtp:0,stun:1,rtcp:0), snk=(98,a:49,v:49,h:0)
[2026-03-04 03:31:31.760][INFO][1][20147715] DTLS: State Active SEND, done=0, arq=9, r0=0, len=312, cnt=22, size=299, hs=1
[2026-03-04 03:31:33.535][INFO][1][4o907o17] https: stream server done, use key /usr/local/srs/conf/certs/api.zhongkerobot.com.key and cert /usr/local/srs/conf/certs/api.zhongkerobot.com.pem, cost=24ms
[2026-03-04 03:31:33.557][INFO][1][4o907o17] HTTP #0 36.143.177.190:14188 GET https://api.zhongkerobot.com:8443/api/v1/vhosts/?callback=angular.callbacks._e2, content-length=-1
[2026-03-04 03:31:33.642][INFO][1][4o907o17] TCP: before dispose resource(HttpsConn)(0x7f54e84618e0), conns=1, zombies=0, ign=0, inz=0, ind=0
[2026-03-04 03:31:33.642][WARN][1][4o907o17][104] client disconnect peer. ret=1007
[2026-03-04 03:31:33.642][INFO][1][s3dq2578] TCP: clear zombies=1 resources, conns=1, removing=0, unsubs=0
[2026-03-04 03:31:33.642][INFO][1][4o907o17] TCP: disposing #0 resource(HttpsConn)(0x7f54e84618e0), conns=1, disposing=1, zombies=0
[2026-03-04 03:31:34.557][INFO][1][7b065691] Process: cpu=1.00%,11MB, threads=2
[2026-03-04 03:31:34.647][INFO][1][2323p931] Hybrid cpu=1.00%,11MB, cid=4,1, timer=62,10,49, clock=0,48,1,0,0,0,0,0,0, free=1
[2026-03-04 03:31:34.647][INFO][1][2323p931] RTC: Server conns=1, spkts=(1,rtp:0,stun:1,rtcp:0), snk=(98,a:49,v:49,h:0)
[2026-03-04 03:31:37.520][INFO][1][666umj89] https: stream server done, use key /usr/local/srs/conf/certs/api.zhongkerobot.com.key and cert /usr/local/srs/conf/certs/api.zhongkerobot.com.pem, cost=15ms
[2026-03-04 03:31:37.532][INFO][1][666umj89] HTTP #0 36.143.177.190:14264 GET https://api.zhongkerobot.com:8443/api/v1/vhosts/?callback=angular.callbacks._e3, content-length=-1
[2026-03-04 03:31:37.605][INFO][1][666umj89] TCP: before dispose resource(HttpsConn)(0x7f54e80a9360), conns=1, zombies=0, ign=0, inz=0, ind=0
[2026-03-04 03:31:37.605][WARN][1][666umj89][104] client disconnect peer. ret=1007
[2026-03-04 03:31:37.605][INFO][1][s3dq2578] TCP: clear zombies=1 resources, conns=1, removing=0, unsubs=0
[2026-03-04 03:31:37.605][INFO][1][666umj89] TCP: disposing #0 resource(HttpsConn)(0x7f54e80a9360), conns=1, disposing=1, zombies=0
[2026-03-04 03:31:39.560][INFO][1][7b065691] Process: cpu=2.00%,11MB, threads=2
[2026-03-04 03:31:39.647][INFO][1][2323p931] Hybrid cpu=2.00%,11MB, cid=3,1, timer=62,10,48, clock=0,48,1,0,0,0,0,0,0, free=1
[2026-03-04 03:31:39.647][INFO][1][20147715] RTC: session destroy by timeout, username=1vm5ma94:Xd4P
[2026-03-04 03:31:39.647][INFO][1][20147715] RTC: before dispose resource(RtcConn)(0x7f54e8269c20), conns=1, zombies=0, ign=0, inz=0, ind=0
[2026-03-04 03:31:39.647][INFO][1][20147715] RTC: session detach from [20147715](RtcConn), disposing=1
[2026-03-04 03:31:39.647][INFO][1][1lz4q2ck] RTC: clear zombies=1 resources, conns=1, removing=0, unsubs=0
[2026-03-04 03:31:39.647][INFO][1][20147715] RTC: disposing #0 resource(RtcConn)(0x7f54e8269c20), conns=1, disposing=1, zombies=0
[2026-03-04 03:31:39.647][INFO][1][20147715] cleanup when unpublish, created=1, deliver=0
[2026-03-04 03:31:39.647][WARN][1][20147715][4][DTLS_HANG] DTLS: Hang, done=0, version=-1, arq=9
[2026-03-04 03:31:39.648][WARN][1][20147715][4][DTLS_HANG] DTLS: Hang, done=0, version=-1, arq=0
[2026-03-04 03:31:41.519][INFO][1][0n9w0416] https: stream server done, use key /usr/local/srs/conf/certs/api.zhongkerobot.com.key and cert /usr/local/srs/conf/certs/api.zhongkerobot.com.pem, cost=20ms
[2026-03-04 03:31:41.535][INFO][1][0n9w0416] HTTP #0 36.143.177.190:14049 GET https://api.zhongkerobot.com:8443/api/v1/vhosts/?callback=angular.callbacks._e4, content-length=-1
[2026-03-04 03:31:41.611][INFO][1][0n9w0416] TCP: before dispose resource(HttpsConn)(0x7f54e839a9e0), conns=1, zombies=0, ign=0, inz=0, ind=0
[2026-03-04 03:31:41.611][WARN][1][0n9w0416][104] client disconnect peer. ret=1007
这是SRS的log日志

1	0.000000	36.143.177.190	172.19.0.2	TCP	66	13959 → 8443 [SYN] Seq=0 Win=65535 Len=0 MSS=1424 WS=256 SACK_PERM
2	0.000027	172.19.0.2	36.143.177.190	TCP	66	8443 → 13959 [SYN, ACK] Seq=0 Ack=1 Win=64240 Len=0 MSS=1460 SACK_PERM WS=128
3	0.021245	36.143.177.190	172.19.0.2	TCP	54	13959 → 8443 [ACK] Seq=1 Ack=1 Win=65280 Len=0
4	0.022189	36.143.177.190	172.19.0.2	TCP	1478	13959 → 8443 [ACK] Seq=1 Ack=1 Win=65280 Len=1424 [TCP PDU reassembled in 6]
5	0.022214	172.19.0.2	36.143.177.190	TCP	54	8443 → 13959 [ACK] Seq=1 Ack=1425 Win=64640 Len=0
6	0.022325	36.143.177.190	172.19.0.2	TLSv1.2	616	Client Hello (SNI=api.zhongkerobot.com)
7	0.022349	172.19.0.2	36.143.177.190	TCP	54	8443 → 13959 [ACK] Seq=1 Ack=1987 Win=65152 Len=0
8	0.023960	172.19.0.2	36.143.177.190	TLSv1.2	2902	Server Hello
9	0.023987	172.19.0.2	36.143.177.190	TLSv1.2	1579	Certificate, Server Key Exchange, Server Hello Done
10	0.045723	36.143.177.190	172.19.0.2	TCP	54	13959 → 8443 [ACK] Seq=1987 Ack=2849 Win=65280 Len=0
11	0.045920	36.143.177.190	172.19.0.2	TCP	54	13959 → 8443 [ACK] Seq=1987 Ack=4374 Win=65280 Len=0
12	0.046328	36.143.177.190	172.19.0.2	TLSv1.2	147	Client Key Exchange, Change Cipher Spec, Encrypted Handshake Message
13	0.046568	172.19.0.2	36.143.177.190	TLSv1.2	280	New Session Ticket, Change Cipher Spec, Encrypted Handshake Message
14	0.067873	36.143.177.190	172.19.0.2	TLSv1.2	782	Application Data
15	0.068331	172.19.0.2	36.143.177.190	TLSv1.2	199	Application Data
16	0.131027	36.143.177.190	172.19.0.2	TCP	54	13959 → 8443 [ACK] Seq=2808 Ack=4745 Win=65024 Len=0
17	0.131047	172.19.0.2	36.143.177.190	TLSv1.2	458	Application Data, Application Data, Application Data, Application Data
18	0.152327	36.143.177.190	172.19.0.2	TCP	54	13959 → 8443 [FIN, ACK] Seq=2808 Ack=5149 Win=64512 Len=0
19	0.152724	172.19.0.2	36.143.177.190	TCP	54	8443 → 13959 [FIN, ACK] Seq=5149 Ack=2809 Win=65152 Len=0
20	0.174474	36.143.177.190	172.19.0.2	TCP	54	13959 → 8443 [ACK] Seq=2809 Ack=5150 Win=64512 Len=0
21	3.990336	36.143.177.190	172.19.0.2	TCP	66	14110 → 8443 [SYN] Seq=0 Win=65535 Len=0 MSS=1424 WS=256 SACK_PERM
22	3.990362	172.19.0.2	36.143.177.190	TCP	66	8443 → 14110 [SYN, ACK] Seq=0 Ack=1 Win=64240 Len=0 MSS=1460 SACK_PERM WS=128
23	4.008773	36.143.177.190	172.19.0.2	TCP	54	14110 → 8443 [ACK] Seq=1 Ack=1 Win=65280 Len=0
24	4.009949	36.143.177.190	172.19.0.2	TCP	1478	14110 → 8443 [ACK] Seq=1 Ack=1 Win=65280 Len=1424 [TCP PDU reassembled in 26]
25	4.009970	172.19.0.2	36.143.177.190	TCP	54	8443 → 14110 [ACK] Seq=1 Ack=1425 Win=64640 Len=0
26	4.010079	36.143.177.190	172.19.0.2	TLSv1.2	520	Client Hello (SNI=api.zhongkerobot.com)
27	4.010088	172.19.0.2	36.143.177.190	TCP	54	8443 → 14110 [ACK] Seq=1 Ack=1891 Win=65152 Len=0
28	4.011412	172.19.0.2	36.143.177.190	TLSv1.2	2902	Server Hello
29	4.011448	172.19.0.2	36.143.177.190	TLSv1.2	1579	Certificate, Server Key Exchange, Server Hello Done
30	4.029841	36.143.177.190	172.19.0.2	TCP	54	14110 → 8443 [ACK] Seq=1891 Ack=2849 Win=65280 Len=0
31	4.029867	36.143.177.190	172.19.0.2	TCP	54	14110 → 8443 [ACK] Seq=1891 Ack=4374 Win=65280 Len=0
32	4.030063	36.143.177.190	172.19.0.2	TLSv1.2	147	Client Key Exchange, Change Cipher Spec, Encrypted Handshake Message
33	4.030343	172.19.0.2	36.143.177.190	TLSv1.2	280	New Session Ticket, Change Cipher Spec, Encrypted Handshake Message
34	4.048627	36.143.177.190	172.19.0.2	TLSv1.2	782	Application Data
35	4.049000	172.19.0.2	36.143.177.190	TLSv1.2	199	Application Data
36	4.108981	36.143.177.190	172.19.0.2	TCP	54	14110 → 8443 [ACK] Seq=2712 Ack=4745 Win=65024 Len=0
37	4.108998	172.19.0.2	36.143.177.190	TLSv1.2	458	Application Data, Application Data, Application Data, Application Data
38	4.127033	36.143.177.190	172.19.0.2	TCP	54	14110 → 8443 [FIN, ACK] Seq=2712 Ack=5149 Win=64512 Len=0
39	4.127335	172.19.0.2	36.143.177.190	TCP	54	8443 → 14110 [FIN, ACK] Seq=5149 Ack=2713 Win=65152 Len=0
40	4.145270	36.143.177.190	172.19.0.2	TCP	54	14110 → 8443 [ACK] Seq=2713 Ack=5150 Win=64512 Len=0
41	7.991302	36.143.177.190	172.19.0.2	TCP	66	14254 → 8443 [SYN] Seq=0 Win=65535 Len=0 MSS=1424 WS=256 SACK_PERM
42	7.991328	172.19.0.2	36.143.177.190	TCP	66	8443 → 14254 [SYN, ACK] Seq=0 Ack=1 Win=64240 Len=0 MSS=1460 SACK_PERM WS=128
43	8.006274	36.143.177.190	172.19.0.2	TCP	54	14254 → 8443 [ACK] Seq=1 Ack=1 Win=65280 Len=0
44	8.007488	36.143.177.190	172.19.0.2	TLSv1.2	2008	Client Hello (SNI=api.zhongkerobot.com)
45	8.007509	172.19.0.2	36.143.177.190	TCP	54	8443 → 14254 [ACK] Seq=1 Ack=1955 Win=62336 Len=0
46	8.008906	172.19.0.2	36.143.177.190	TLSv1.2	2902	Server Hello
47	8.008938	172.19.0.2	36.143.177.190	TLSv1.2	1579	Certificate, Server Key Exchange, Server Hello Done
48	8.024029	36.143.177.190	172.19.0.2	TCP	54	14254 → 8443 [ACK] Seq=1955 Ack=2849 Win=65280 Len=0
49	8.024218	36.143.177.190	172.19.0.2	TCP	54	14254 → 8443 [ACK] Seq=1955 Ack=4374 Win=65280 Len=0
50	8.024382	36.143.177.190	172.19.0.2	TLSv1.2	147	Client Key Exchange, Change Cipher Spec, Encrypted Handshake Message
51	8.024645	172.19.0.2	36.143.177.190	TLSv1.2	280	New Session Ticket, Change Cipher Spec, Encrypted Handshake Message
52	8.039431	36.143.177.190	172.19.0.2	TLSv1.2	782	Application Data
53	8.039973	172.19.0.2	36.143.177.190	TLSv1.2	199	Application Data
54	8.106038	36.143.177.190	172.19.0.2	TCP	54	14254 → 8443 [ACK] Seq=2776 Ack=4745 Win=65024 Len=0
55	8.106055	172.19.0.2	36.143.177.190	TLSv1.2	458	Application Data, Application Data, Application Data, Application Data
56	8.120953	36.143.177.190	172.19.0.2	TCP	54	14254 → 8443 [FIN, ACK] Seq=2776 Ack=5149 Win=64512 Len=0
57	8.121261	172.19.0.2	36.143.177.190	TCP	54	8443 → 14254 [FIN, ACK] Seq=5149 Ack=2777 Win=61696 Len=0
58	8.136528	36.143.177.190	172.19.0.2	TCP	54	14254 → 8443 [ACK] Seq=2777 Ack=5150 Win=64512 Len=0
59	11.987236	36.143.177.190	172.19.0.2	TCP	66	13839 → 8443 [SYN] Seq=0 Win=65535 Len=0 MSS=1424 WS=256 SACK_PERM
60	11.987265	172.19.0.2	36.143.177.190	TCP	66	8443 → 13839 [SYN, ACK] Seq=0 Ack=1 Win=64240 Len=0 MSS=1460 SACK_PERM WS=128
61	12.002449	36.143.177.190	172.19.0.2	TCP	54	13839 → 8443 [ACK] Seq=1 Ack=1 Win=65280 Len=0
62	12.004363	36.143.177.190	172.19.0.2	TLSv1.2	2008	Client Hello (SNI=api.zhongkerobot.com)
63	12.004392	172.19.0.2	36.143.177.190	TCP	54	8443 → 13839 [ACK] Seq=1 Ack=1955 Win=64640 Len=0
64	12.005760	172.19.0.2	36.143.177.190	TLSv1.2	2902	Server Hello
65	12.005789	172.19.0.2	36.143.177.190	TLSv1.2	1579	Certificate, Server Key Exchange, Server Hello Done
66	12.021124	36.143.177.190	172.19.0.2	TCP	54	13839 → 8443 [ACK] Seq=1955 Ack=2849 Win=65280 Len=0
67	12.021263	36.143.177.190	172.19.0.2	TCP	54	13839 → 8443 [ACK] Seq=1955 Ack=4374 Win=65280 Len=0
68	12.021512	36.143.177.190	172.19.0.2	TLSv1.2	147	Client Key Exchange, Change Cipher Spec, Encrypted Handshake Message
69	12.021744	172.19.0.2	36.143.177.190	TLSv1.2	280	New Session Ticket, Change Cipher Spec, Encrypted Handshake Message
70	12.036550	36.143.177.190	172.19.0.2	TLSv1.2	782	Application Data
71	12.037082	172.19.0.2	36.143.177.190	TLSv1.2	199	Application Data
72	12.092438	36.143.177.190	172.19.0.2	TCP	54	13839 → 8443 [ACK] Seq=2776 Ack=4745 Win=65024 Len=0
73	12.092459	172.19.0.2	36.143.177.190	TLSv1.2	458	Application Data, Application Data, Application Data, Application Data
74	12.107650	36.143.177.190	172.19.0.2	TCP	54	13839 → 8443 [FIN, ACK] Seq=2776 Ack=5149 Win=64512 Len=0
75	12.108020	172.19.0.2	36.143.177.190	TCP	54	8443 → 13839 [FIN, ACK] Seq=5149 Ack=2777 Win=65664 Len=0
76	12.122913	36.143.177.190	172.19.0.2	TCP	54	13839 → 8443 [ACK] Seq=2777 Ack=5150 Win=64512 Len=0
77	15.988510	36.143.177.190	172.19.0.2	TCP	66	13952 → 8443 [SYN] Seq=0 Win=65535 Len=0 MSS=1424 WS=256 SACK_PERM
78	15.988535	172.19.0.2	36.143.177.190	TCP	66	8443 → 13952 [SYN, ACK] Seq=0 Ack=1 Win=64240 Len=0 MSS=1460 SACK_PERM WS=128
79	16.003398	36.143.177.190	172.19.0.2	TCP	54	13952 → 8443 [ACK] Seq=1 Ack=1 Win=65280 Len=0
80	16.004601	36.143.177.190	172.19.0.2	TCP	1478	13952 → 8443 [ACK] Seq=1 Ack=1 Win=65280 Len=1424 [TCP PDU reassembled in 82]
81	16.004624	172.19.0.2	36.143.177.190	TCP	54	8443 → 13952 [ACK] Seq=1 Ack=1425 Win=64640 Len=0
82	16.004816	36.143.177.190	172.19.0.2	TLSv1.2	520	Client Hello (SNI=api.zhongkerobot.com)
83	16.004823	172.19.0.2	36.143.177.190	TCP	54	8443 → 13952 [ACK] Seq=1 Ack=1891 Win=65152 Len=0
84	16.006174	172.19.0.2	36.143.177.190	TLSv1.2	2902	Server Hello
85	16.006197	172.19.0.2	36.143.177.190	TLSv1.2	1579	Certificate, Server Key Exchange, Server Hello Done
86	16.020925	36.143.177.190	172.19.0.2	TCP	54	13952 → 8443 [ACK] Seq=1891 Ack=2849 Win=65280 Len=0
87	16.020927	36.143.177.190	172.19.0.2	TCP	54	13952 → 8443 [ACK] Seq=1891 Ack=4374 Win=65280 Len=0
88	16.020974	36.143.177.190	172.19.0.2	TLSv1.2	147	Client Key Exchange, Change Cipher Spec, Encrypted Handshake Message
89	16.021644	172.19.0.2	36.143.177.190	TLSv1.2	280	New Session Ticket, Change Cipher Spec, Encrypted Handshake Message
90	16.036015	36.143.177.190	172.19.0.2	TLSv1.2	782	Application Data
91	16.036540	172.19.0.2	36.143.177.190	TLSv1.2	199	Application Data
92	16.093681	36.143.177.190	172.19.0.2	TCP	54	13952 → 8443 [ACK] Seq=2712 Ack=4745 Win=65024 Len=0
93	16.093710	172.19.0.2	36.143.177.190	TLSv1.2	458	Application Data, Application Data, Application Data, Application Data
94	16.108942	36.143.177.190	172.19.0.2	TCP	54	13952 → 8443 [FIN, ACK] Seq=2712 Ack=5149 Win=64512 Len=0
95	16.109221	172.19.0.2	36.143.177.190	TCP	54	8443 → 13952 [FIN, ACK] Seq=5149 Ack=2713 Win=65152 Len=0
96	16.123619	36.143.177.190	172.19.0.2	TCP	54	13952 → 8443 [ACK] Seq=2713 Ack=5150 Win=64512 Len=0
97	19.765719	36.143.177.190	172.19.0.2	TCP	58	14097 → 8443 [SYN] Seq=0 Win=5760 Len=0 MSS=1424
98	19.765745	172.19.0.2	36.143.177.190	TCP	58	8443 → 14097 [SYN, ACK] Seq=0 Ack=1 Win=64240 Len=0 MSS=1460
99	19.788884	36.143.177.190	172.19.0.2	TCP	54	14097 → 8443 [ACK] Seq=1 Ack=1 Win=5760 Len=0
100	19.793549	36.143.177.190	172.19.0.2	TLSv1.2	307	Client Hello (SNI=api.zhongkerobot.com)
101	19.793574	172.19.0.2	36.143.177.190	TCP	54	8443 → 14097 [ACK] Seq=1 Ack=254 Win=63987 Len=0
102	19.794989	172.19.0.2	36.143.177.190	TLSv1.2	2902	Server Hello
103	19.795033	172.19.0.2	36.143.177.190	TLSv1.2	1579	Certificate, Server Key Exchange, Server Hello Done
104	19.811869	36.143.177.190	172.19.0.2	TCP	54	14097 → 8443 [ACK] Seq=254 Ack=2849 Win=2912 Len=0
105	19.812399	36.143.177.190	172.19.0.2	TCP	54	14097 → 8443 [ACK] Seq=254 Ack=4374 Win=1387 Len=0
106	19.812715	36.143.177.190	172.19.0.2	TCP	54	[TCP Window Update] 14097 → 8443 [ACK] Seq=254 Ack=4374 Win=5446 Len=0
107	19.996354	36.143.177.190	172.19.0.2	TCP	66	14099 → 8443 [SYN] Seq=0 Win=65535 Len=0 MSS=1424 WS=256 SACK_PERM
108	19.996379	172.19.0.2	36.143.177.190	TCP	66	8443 → 14099 [SYN, ACK] Seq=0 Ack=1 Win=64240 Len=0 MSS=1460 SACK_PERM WS=128
109	20.016338	36.143.177.190	172.19.0.2	TCP	54	14099 → 8443 [ACK] Seq=1 Ack=1 Win=65280 Len=0
110	20.017294	36.143.177.190	172.19.0.2	TLSv1.2	2008	Client Hello (SNI=api.zhongkerobot.com)
111	20.017313	172.19.0.2	36.143.177.190	TCP	54	8443 → 14099 [ACK] Seq=1 Ack=1955 Win=62336 Len=0
112	20.018671	172.19.0.2	36.143.177.190	TLSv1.2	2902	Server Hello
113	20.018701	172.19.0.2	36.143.177.190	TLSv1.2	1579	Certificate, Server Key Exchange, Server Hello Done
114	20.038804	36.143.177.190	172.19.0.2	TCP	54	14099 → 8443 [ACK] Seq=1955 Ack=2849 Win=65280 Len=0
115	20.039027	36.143.177.190	172.19.0.2	TCP	54	14099 → 8443 [ACK] Seq=1955 Ack=4374 Win=65280 Len=0
116	20.039108	36.143.177.190	172.19.0.2	TLSv1.2	147	Client Key Exchange, Change Cipher Spec, Encrypted Handshake Message
117	20.039362	172.19.0.2	36.143.177.190	TLSv1.2	280	New Session Ticket, Change Cipher Spec, Encrypted Handshake Message
118	20.058923	36.143.177.190	172.19.0.2	TLSv1.2	782	Application Data
119	20.059284	172.19.0.2	36.143.177.190	TLSv1.2	199	Application Data
120	20.070508	36.143.177.190	172.19.0.2	TLSv1.2	96	Client Key Exchange
121	20.111317	172.19.0.2	36.143.177.190	TCP	54	8443 → 14097 [ACK] Seq=4374 Ack=296 Win=63987 Len=0
122	20.124273	36.143.177.190	172.19.0.2	TLSv1.2	105	Change Cipher Spec, Encrypted Handshake Message
123	20.124297	172.19.0.2	36.143.177.190	TCP	54	8443 → 14097 [ACK] Seq=4374 Ack=347 Win=63987 Len=0
124	20.124520	172.19.0.2	36.143.177.190	TLSv1.2	280	New Session Ticket, Change Cipher Spec, Encrypted Handshake Message
125	20.125782	36.143.177.190	172.19.0.2	TCP	54	14099 → 8443 [ACK] Seq=2776 Ack=4745 Win=65024 Len=0
126	20.125798	172.19.0.2	36.143.177.190	TLSv1.2	458	Application Data, Application Data, Application Data, Application Data
127	20.145608	36.143.177.190	172.19.0.2	TCP	54	14099 → 8443 [FIN, ACK] Seq=2776 Ack=5149 Win=64512 Len=0
128	20.145972	172.19.0.2	36.143.177.190	TCP	54	8443 → 14099 [FIN, ACK] Seq=5149 Ack=2777 Win=61696 Len=0
129	20.150251	36.143.177.190	172.19.0.2	TLSv1.2	277	Application Data
130	20.166073	36.143.177.190	172.19.0.2	TCP	54	14099 → 8443 [ACK] Seq=2777 Ack=5150 Win=64512 Len=0
131	20.190311	172.19.0.2	36.143.177.190	TCP	54	8443 → 14097 [ACK] Seq=4600 Ack=570 Win=63987 Len=0
132	20.205302	36.143.177.190	172.19.0.2	TLSv1.2	1460	Application Data
133	20.205322	172.19.0.2	36.143.177.190	TCP	54	8443 → 14097 [ACK] Seq=4600 Ack=1976 Win=63270 Len=0
134	20.406969	172.19.0.2	36.143.177.190	TLSv1.2	302	Application Data
135	20.500146	36.143.177.190	172.19.0.2	TCP	54	14097 → 8443 [ACK] Seq=1976 Ack=4848 Win=4972 Len=0
136	20.500168	172.19.0.2	36.143.177.190	TLSv1.2	1297	Application Data
137	20.512915	36.143.177.190	172.19.0.2	TCP	54	14097 → 8443 [ACK] Seq=1976 Ack=6091 Win=5760 Len=0
138	20.620488	36.143.177.190	172.19.0.2	TCP	54	14097 → 8443 [FIN, ACK] Seq=1976 Ack=6091 Win=5760 Len=0
139	20.620752	172.19.0.2	36.143.177.190	TCP	54	8443 → 14097 [FIN, ACK] Seq=6091 Ack=1977 Win=63270 Len=0
140	20.634104	36.143.177.190	172.19.0.2	TCP	54	14097 → 8443 [ACK] Seq=1977 Ack=6092 Win=5759 Len=0
141	20.706482	36.143.177.190	172.19.0.2	STUN	126	Binding Request user: 1vm5ma94:Xd4P
142	20.721355	172.19.0.2	36.143.177.190	STUN	126	Binding Success Response user: 1vm5ma94:Xd4P XOR-MAPPED-ADDRESS: 36.143.177.190:14126
143	20.721486	172.19.0.2	36.143.177.190	DTLS	354	Client Hello
144	20.752691	36.143.177.190	172.19.0.2	STUN	138	Binding Request user: 1vm5ma94:Xd4P
145	20.752807	172.19.0.2	36.143.177.190	STUN	126	Binding Success Response user: 1vm5ma94:Xd4P XOR-MAPPED-ADDRESS: 36.143.177.190:14126
146	20.757004	172.19.0.2	36.143.177.190	DTLS	354	Client Hello
147	20.857716	172.19.0.2	36.143.177.190	DTLS	354	Client Hello
148	21.057807	172.19.0.2	36.143.177.190	DTLS	354	Client Hello
149	21.086447	36.143.177.190	172.19.0.2	STUN	138	Binding Request user: 1vm5ma94:Xd4P
150	21.086551	172.19.0.2	36.143.177.190	STUN	126	Binding Success Response user: 1vm5ma94:Xd4P XOR-MAPPED-ADDRESS: 36.143.177.190:14126
151	21.458568	172.19.0.2	36.143.177.190	DTLS	354	Client Hello
152	21.656670	36.143.177.190	172.19.0.2	STUN	138	Binding Request user: 1vm5ma94:Xd4P
153	21.656807	172.19.0.2	36.143.177.190	STUN	126	Binding Success Response user: 1vm5ma94:Xd4P XOR-MAPPED-ADDRESS: 36.143.177.190:14126
154	22.196705	36.143.177.190	172.19.0.2	STUN	138	Binding Request user: 1vm5ma94:Xd4P
155	22.196826	172.19.0.2	36.143.177.190	STUN	126	Binding Success Response user: 1vm5ma94:Xd4P XOR-MAPPED-ADDRESS: 36.143.177.190:14126
156	22.259420	172.19.0.2	36.143.177.190	DTLS	354	Client Hello
157	22.626224	36.143.177.190	172.19.0.2	STUN	138	Binding Request user: 1vm5ma94:Xd4P
158	22.626354	172.19.0.2	36.143.177.190	STUN	126	Binding Success Response user: 1vm5ma94:Xd4P XOR-MAPPED-ADDRESS: 36.143.177.190:14126
159	23.166180	36.143.177.190	172.19.0.2	STUN	138	Binding Request user: 1vm5ma94:Xd4P
160	23.166315	172.19.0.2	36.143.177.190	STUN	126	Binding Success Response user: 1vm5ma94:Xd4P XOR-MAPPED-ADDRESS: 36.143.177.190:14126
161	23.860237	172.19.0.2	36.143.177.190	DTLS	354	Client Hello
162	23.988804	36.143.177.190	172.19.0.2	TCP	66	14188 → 8443 [SYN] Seq=0 Win=65535 Len=0 MSS=1424 WS=256 SACK_PERM
163	23.988827	172.19.0.2	36.143.177.190	TCP	66	8443 → 14188 [SYN, ACK] Seq=0 Ack=1 Win=64240 Len=0 MSS=1460 SACK_PERM WS=128
164	24.009006	36.143.177.190	172.19.0.2	TCP	54	14188 → 8443 [ACK] Seq=1 Ack=1 Win=65280 Len=0
165	24.010192	36.143.177.190	172.19.0.2	TLSv1.2	2040	Client Hello (SNI=api.zhongkerobot.com)
166	24.010211	172.19.0.2	36.143.177.190	TCP	54	8443 → 14188 [ACK] Seq=1 Ack=1987 Win=62336 Len=0
167	24.011571	172.19.0.2	36.143.177.190	TLSv1.2	2902	Server Hello
168	24.011604	172.19.0.2	36.143.177.190	TLSv1.2	1579	Certificate, Server Key Exchange, Server Hello Done
169	24.032055	36.143.177.190	172.19.0.2	TCP	54	14188 → 8443 [ACK] Seq=1987 Ack=2849 Win=65280 Len=0
170	24.032106	36.143.177.190	172.19.0.2	TCP	54	14188 → 8443 [ACK] Seq=1987 Ack=4374 Win=65280 Len=0
171	24.032268	36.143.177.190	172.19.0.2	TLSv1.2	147	Client Key Exchange, Change Cipher Spec, Encrypted Handshake Message
172	24.032513	172.19.0.2	36.143.177.190	TLSv1.2	280	New Session Ticket, Change Cipher Spec, Encrypted Handshake Message
173	24.052674	36.143.177.190	172.19.0.2	TLSv1.2	782	Application Data
174	24.053108	172.19.0.2	36.143.177.190	TLSv1.2	199	Application Data
175	24.122518	36.143.177.190	172.19.0.2	TCP	54	14188 → 8443 [ACK] Seq=2808 Ack=4745 Win=65024 Len=0
176	24.122536	172.19.0.2	36.143.177.190	TLSv1.2	458	Application Data, Application Data, Application Data, Application Data
177	24.142907	36.143.177.190	172.19.0.2	TCP	54	14188 → 8443 [FIN, ACK] Seq=2808 Ack=5149 Win=64512 Len=0
178	24.143224	172.19.0.2	36.143.177.190	TCP	54	8443 → 14188 [FIN, ACK] Seq=5149 Ack=2809 Win=61696 Len=0
179	24.163525	36.143.177.190	172.19.0.2	TCP	54	14188 → 8443 [ACK] Seq=2809 Ack=5150 Win=64512 Len=0
180	27.061152	172.19.0.2	36.143.177.190	DTLS	354	Client Hello
181	27.989636	36.143.177.190	172.19.0.2	TCP	66	14311 → 8443 [SYN] Seq=0 Win=65535 Len=0 MSS=1424 WS=256 SACK_PERM
182	27.989662	172.19.0.2	36.143.177.190	TCP	66	8443 → 14311 [SYN, ACK] Seq=0 Ack=1 Win=64240 Len=0 MSS=1460 SACK_PERM WS=128
183	28.007856	36.143.177.190	172.19.0.2	TCP	54	14311 → 8443 [ACK] Seq=1 Ack=1 Win=65280 Len=0
184	28.008795	36.143.177.190	172.19.0.2	TLSv1.2	2040	Client Hello (SNI=api.zhongkerobot.com)
185	28.008819	172.19.0.2	36.143.177.190	TCP	54	8443 → 14311 [ACK] Seq=1 Ack=1987 Win=62336 Len=0
186	28.010419	172.19.0.2	36.143.177.190	TLSv1.2	2902	Server Hello
187	28.010452	172.19.0.2	36.143.177.190	TLSv1.2	1579	Certificate, Server Key Exchange, Server Hello Done
188	28.028803	36.143.177.190	172.19.0.2	TCP	54	14311 → 8443 [ACK] Seq=1987 Ack=2849 Win=65280 Len=0
189	28.029009	36.143.177.190	172.19.0.2	TLSv1.2	147	Client Key Exchange, Change Cipher Spec, Encrypted Handshake Message
190	28.029152	36.143.177.190	172.19.0.2	TCP	54	14311 → 8443 [ACK] Seq=1987 Ack=4374 Win=65280 Len=0
191	28.029426	172.19.0.2	36.143.177.190	TLSv1.2	280	New Session Ticket, Change Cipher Spec, Encrypted Handshake Message
192	28.047402	36.143.177.190	172.19.0.2	TLSv1.2	782	Application Data
193	28.047802	172.19.0.2	36.143.177.190	TLSv1.2	199	Application Data
194	28.115816	36.143.177.190	172.19.0.2	TCP	54	14311 → 8443 [ACK] Seq=2808 Ack=4745 Win=65024 Len=0
195	28.115834	172.19.0.2	36.143.177.190	TLSv1.2	458	Application Data, Application Data, Application Data, Application Data
196	28.134065	36.143.177.190	172.19.0.2	TCP	54	14311 → 8443 [FIN, ACK] Seq=2808 Ack=5149 Win=64512 Len=0
197	28.135258	172.19.0.2	36.143.177.190	TCP	54	8443 → 14311 [FIN, ACK] Seq=5149 Ack=2809 Win=61696 Len=0
198	28.153282	36.143.177.190	172.19.0.2	TCP	54	14311 → 8443 [ACK] Seq=2809 Ack=5150 Win=64512 Len=0
199	31.989102	36.143.177.190	172.19.0.2	TCP	66	13913 → 8443 [SYN] Seq=0 Win=65535 Len=0 MSS=1424 WS=256 SACK_PERM
200	31.989133	172.19.0.2	36.143.177.190	TCP	66	8443 → 13913 [SYN, ACK] Seq=0 Ack=1 Win=64240 Len=0 MSS=1460 SACK_PERM WS=128
201	32.006762	36.143.177.190	172.19.0.2	TCP	54	13913 → 8443 [ACK] Seq=1 Ack=1 Win=65280 Len=0
202	32.008192	36.143.177.190	172.19.0.2	TCP	1478	13913 → 8443 [ACK] Seq=1 Ack=1 Win=65280 Len=1424 [TCP PDU reassembled in 204]
203	32.008216	172.19.0.2	36.143.177.190	TCP	54	8443 → 13913 [ACK] Seq=1 Ack=1425 Win=64640 Len=0
204	32.008421	36.143.177.190	172.19.0.2	TLSv1.2	552	Client Hello (SNI=api.zhongkerobot.com)
205	32.008435	172.19.0.2	36.143.177.190	TCP	54	8443 → 13913 [ACK] Seq=1 Ack=1923 Win=65152 Len=0
206	32.010028	172.19.0.2	36.143.177.190	TLSv1.2	2902	Server Hello
207	32.010058	172.19.0.2	36.143.177.190	TLSv1.2	1579	Certificate, Server Key Exchange, Server Hello Done
208	32.027824	36.143.177.190	172.19.0.2	TCP	54	13913 → 8443 [ACK] Seq=1923 Ack=2849 Win=65280 Len=0
209	32.027851	36.143.177.190	172.19.0.2	TCP	54	13913 → 8443 [ACK] Seq=1923 Ack=4374 Win=65280 Len=0
210	32.028471	36.143.177.190	172.19.0.2	TLSv1.2	147	Client Key Exchange, Change Cipher Spec, Encrypted Handshake Message
211	32.028760	172.19.0.2	36.143.177.190	TLSv1.2	280	New Session Ticket, Change Cipher Spec, Encrypted Handshake Message
212	32.046421	36.143.177.190	172.19.0.2	TLSv1.2	782	Application Data
213	32.046770	172.19.0.2	36.143.177.190	TLSv1.2	199	Application Data
214	32.116518	36.143.177.190	172.19.0.2	TCP	54	13913 → 8443 [ACK] Seq=2744 Ack=4745 Win=65024 Len=0
215	32.116536	172.19.0.2	36.143.177.190	TLSv1.2	458	Application Data, Application Data, Application Data, Application Data
216	32.134524	36.143.177.190	172.19.0.2	TCP	54	13913 → 8443 [FIN, ACK] Seq=2744 Ack=5149 Win=64512 Len=0
217	32.134872	172.19.0.2	36.143.177.190	TCP	54	8443 → 13913 [FIN, ACK] Seq=5149 Ack=2745 Win=65152 Len=0
218	32.152204	36.143.177.190	172.19.0.2	TCP	54	13913 → 8443 [ACK] Seq=2745 Ack=5150 Win=64512 Len=0
219	33.461386	172.19.0.2	36.143.177.190	DTLS	354	Client Hello
220	35.986013	36.143.177.190	172.19.0.2	TCP	66	14017 → 8443 [SYN] Seq=0 Win=65535 Len=0 MSS=1424 WS=256 SACK_PERM
221	35.986044	172.19.0.2	36.143.177.190	TCP	66	8443 → 14017 [SYN, ACK] Seq=0 Ack=1 Win=64240 Len=0 MSS=1460 SACK_PERM WS=128
222	35.997936	36.143.177.190	172.19.0.2	TCP	54	14017 → 8443 [ACK] Seq=1 Ack=1 Win=65280 Len=0
223	35.999382	36.143.177.190	172.19.0.2	TLSv1.2	2008	Client Hello (SNI=api.zhongkerobot.com)
224	35.999403	172.19.0.2	36.143.177.190	TCP	54	8443 → 14017 [ACK] Seq=1 Ack=1955 Win=62336 Len=0
225	36.000799	172.19.0.2	36.143.177.190	TLSv1.2	2902	Server Hello
226	36.000828	172.19.0.2	36.143.177.190	TLSv1.2	1579	Certificate, Server Key Exchange, Server Hello Done
227	36.012951	36.143.177.190	172.19.0.2	TCP	54	14017 → 8443 [ACK] Seq=1955 Ack=2849 Win=65280 Len=0
228	36.013163	36.143.177.190	172.19.0.2	TCP	54	14017 → 8443 [ACK] Seq=1955 Ack=4374 Win=65280 Len=0
229	36.013469	36.143.177.190	172.19.0.2	TLSv1.2	147	Client Key Exchange, Change Cipher Spec, Encrypted Handshake Message
230	36.013720	172.19.0.2	36.143.177.190	TLSv1.2	280	New Session Ticket, Change Cipher Spec, Encrypted Handshake Message
231	36.025570	36.143.177.190	172.19.0.2	TLSv1.2	782	Application Data
232	36.026058	172.19.0.2	36.143.177.190	TLSv1.2	199	Application Data
233	36.086954	36.143.177.190	172.19.0.2	TCP	54	14017 → 8443 [ACK] Seq=2776 Ack=4745 Win=65024 Len=0
234	36.086974	172.19.0.2	36.143.177.190	TLSv1.2	458	Application Data, Application Data, Application Data, Application Data
235	36.099159	36.143.177.190	172.19.0.2	TCP	54	14017 → 8443 [FIN, ACK] Seq=2776 Ack=5149 Win=64512 Len=0
236	36.099560	172.19.0.2	36.143.177.190	TCP	54	8443 → 14017 [FIN, ACK] Seq=5149 Ack=2777 Win=61696 Len=0
237	36.111674	36.143.177.190	172.19.0.2	TCP	54	14017 → 8443 [ACK] Seq=2777 Ack=5150 Win=64512 Len=0
238	39.981821	36.143.177.190	172.19.0.2	TCP	66	14057 → 8443 [SYN] Seq=0 Win=65535 Len=0 MSS=1424 WS=256 SACK_PERM
239	39.981851	172.19.0.2	36.143.177.190	TCP	66	8443 → 14057 [SYN, ACK] Seq=0 Ack=1 Win=64240 Len=0 MSS=1460 SACK_PERM WS=128
240	39.993441	36.143.177.190	172.19.0.2	TCP	54	14057 → 8443 [ACK] Seq=1 Ack=1 Win=65280 Len=0
241	39.994368	36.143.177.190	172.19.0.2	TCP	1478	14057 → 8443 [ACK] Seq=1 Ack=1 Win=65280 Len=1424 [TCP PDU reassembled in 243]
242	39.994395	172.19.0.2	36.143.177.190	TCP	54	8443 → 14057 [ACK] Seq=1 Ack=1425 Win=64640 Len=0
243	39.994452	36.143.177.190	172.19.0.2	TLSv1.2	616	Client Hello (SNI=api.zhongkerobot.com)
244	39.994461	172.19.0.2	36.143.177.190	TCP	54	8443 → 14057 [ACK] Seq=1 Ack=1987 Win=65152 Len=0
245	39.995947	172.19.0.2	36.143.177.190	TLSv1.2	2902	Server Hello
246	39.995980	172.19.0.2	36.143.177.190	TLSv1.2	1579	Certificate, Server Key Exchange, Server Hello Done
247	40.007725	36.143.177.190	172.19.0.2	TCP	54	14057 → 8443 [ACK] Seq=1987 Ack=2849 Win=65280 Len=0
248	40.007764	36.143.177.190	172.19.0.2	TCP	54	14057 → 8443 [ACK] Seq=1987 Ack=4374 Win=65280 Len=0
249	40.008014	36.143.177.190	172.19.0.2	TLSv1.2	147	Client Key Exchange, Change Cipher Spec, Encrypted Handshake Message
250	40.008260	172.19.0.2	36.143.177.190	TLSv1.2	280	New Session Ticket, Change Cipher Spec, Encrypted Handshake Message
251	40.019374	36.143.177.190	172.19.0.2	TLSv1.2	782	Application Data
252	40.019727	172.19.0.2	36.143.177.190	TLSv1.2	199	Application Data
253	40.080044	36.143.177.190	172.19.0.2	TCP	54	14057 → 8443 [ACK] Seq=2808 Ack=4745 Win=65024 Len=0
254	40.080065	172.19.0.2	36.143.177.190	TLSv1.2	458	Application Data, Application Data, Application Data, Application Data
255	40.091432	36.143.177.190	172.19.0.2	TCP	54	14057 → 8443 [FIN, ACK] Seq=2808 Ack=5149 Win=64512 Len=0
256	40.091796	172.19.0.2	36.143.177.190	TCP	54	8443 → 14057 [FIN, ACK] Seq=5149 Ack=2809 Win=65152 Len=0
257	40.103228	36.143.177.190	172.19.0.2	TCP	54	14057 → 8443 [ACK] Seq=2809 Ack=5150 Win=64512 Len=0
258	43.985227	36.143.177.190	172.19.0.2	TCP	66	14113 → 8443 [SYN] Seq=0 Win=65535 Len=0 MSS=1424 WS=256 SACK_PERM
259	43.985252	172.19.0.2	36.143.177.190	TCP	66	8443 → 14113 [SYN, ACK] Seq=0 Ack=1 Win=64240 Len=0 MSS=1460 SACK_PERM WS=128
260	44.000476	36.143.177.190	172.19.0.2	TCP	54	14113 → 8443 [ACK] Seq=1 Ack=1 Win=65280 Len=0
261	44.002381	36.143.177.190	172.19.0.2	TCP	1478	14113 → 8443 [ACK] Seq=1 Ack=1 Win=65280 Len=1424 [TCP PDU reassembled in 263]
262	44.002403	172.19.0.2	36.143.177.190	TCP	54	8443 → 14113 [ACK] Seq=1 Ack=1425 Win=67072 Len=0
263	44.002519	36.143.177.190	172.19.0.2	TLSv1.2	616	Client Hello (SNI=api.zhongkerobot.com)
264	44.002529	172.19.0.2	36.143.177.190	TCP	54	8443 → 14113 [ACK] Seq=1 Ack=1987 Win=69888 Len=0
265	44.003879	172.19.0.2	36.143.177.190	TLSv1.2	2902	Server Hello
266	44.003912	172.19.0.2	36.143.177.190	TLSv1.2	1579	Certificate, Server Key Exchange, Server Hello Done
267	44.019430	36.143.177.190	172.19.0.2	TCP	54	14113 → 8443 [ACK] Seq=1987 Ack=4374 Win=65280 Len=0
268	44.020802	36.143.177.190	172.19.0.2	TLSv1.2	147	Client Key Exchange, Change Cipher Spec, Encrypted Handshake Message
269	44.021055	172.19.0.2	36.143.177.190	TLSv1.2	280	New Session Ticket, Change Cipher Spec, Encrypted Handshake Message
270	44.036075	36.143.177.190	172.19.0.2	TLSv1.2	782	Application Data
271	44.036574	172.19.0.2	36.143.177.190	TLSv1.2	199	Application Data
272	44.103179	36.143.177.190	172.19.0.2	TCP	54	14113 → 8443 [ACK] Seq=2808 Ack=4745 Win=65024 Len=0
273	44.103195	172.19.0.2	36.143.177.190	TLSv1.2	458	Application Data, Application Data, Application Data, Application Data
274	44.118180	36.143.177.190	172.19.0.2	TCP	54	14113 → 8443 [FIN, ACK] Seq=2808 Ack=5149 Win=64512 Len=0
275	44.118503	172.19.0.2	36.143.177.190	TCP	54	8443 → 14113 [FIN, ACK] Seq=5149 Ack=2809 Win=72704 Len=0
276	44.133571	36.143.177.190	172.19.0.2	TCP	54	14113 → 8443 [ACK] Seq=2809 Ack=5150 Win=64512 Len=0
277	46.262104	172.19.0.2	36.143.177.190	DTLS	354	Client Hello
278	47.992488	36.143.177.190	172.19.0.2	TCP	66	[TCP Port numbers reused] 14188 → 8443 [SYN] Seq=0 Win=65535 Len=0 MSS=1424 WS=256 SACK_PERM
279	47.992516	172.19.0.2	36.143.177.190	TCP	66	8443 → 14188 [SYN, ACK] Seq=0 Ack=1 Win=64240 Len=0 MSS=1460 SACK_PERM WS=128
280	48.012771	36.143.177.190	172.19.0.2	TCP	54	14188 → 8443 [ACK] Seq=1 Ack=1 Win=65280 Len=0
281	48.014366	36.143.177.190	172.19.0.2	TLSv1.2	1944	Client Hello (SNI=api.zhongkerobot.com)
282	48.014388	172.19.0.2	36.143.177.190	TCP	54	8443 → 14188 [ACK] Seq=1 Ack=1891 Win=62464 Len=0
283	48.015998	172.19.0.2	36.143.177.190	TLSv1.2	2902	Server Hello
284	48.016035	172.19.0.2	36.143.177.190	TLSv1.2	1579	Certificate, Server Key Exchange, Server Hello Done
285	48.036692	36.143.177.190	172.19.0.2	TCP	54	14188 → 8443 [ACK] Seq=1891 Ack=2849 Win=65280 Len=0
286	48.036907	36.143.177.190	172.19.0.2	TCP	54	14188 → 8443 [ACK] Seq=1891 Ack=4374 Win=65280 Len=0
287	48.037262	36.143.177.190	172.19.0.2	TLSv1.2	147	Client Key Exchange, Change Cipher Spec, Encrypted Handshake Message
288	48.037538	172.19.0.2	36.143.177.190	TLSv1.2	280	New Session Ticket, Change Cipher Spec, Encrypted Handshake Message
289	48.058306	36.143.177.190	172.19.0.2	TLSv1.2	782	Application Data
290	48.058919	172.19.0.2	36.143.177.190	TLSv1.2	199	Application Data
291	48.123187	36.143.177.190	172.19.0.2	TCP	54	14188 → 8443 [ACK] Seq=2712 Ack=4745 Win=65024 Len=0
292	48.123215	172.19.0.2	36.143.177.190	TLSv1.2	458	Application Data, Application Data, Application Data, Application Data
293	48.143659	36.143.177.190	172.19.0.2	TCP	54	14188 → 8443 [FIN, ACK] Seq=2712 Ack=5149 Win=64512 Len=0
294	48.143935	172.19.0.2	36.143.177.190	TCP	54	8443 → 14188 [FIN, ACK] Seq=5149 Ack=2713 Win=61824 Len=0
295	48.164369	36.143.177.190	172.19.0.2	TCP	54	14188 → 8443 [ACK] Seq=2713 Ack=5150 Win=64512 Len=0
296	51.995061	36.143.177.190	172.19.0.2	TCP	66	14264 → 8443 [SYN] Seq=0 Win=65535 Len=0 MSS=1424 WS=256 SACK_PERM
297	51.995087	172.19.0.2	36.143.177.190	TCP	66	8443 → 14264 [SYN, ACK] Seq=0 Ack=1 Win=64240 Len=0 MSS=1460 SACK_PERM WS=128
298	52.006974	36.143.177.190	172.19.0.2	TCP	54	14264 → 8443 [ACK] Seq=1 Ack=1 Win=65280 Len=0
299	52.008173	36.143.177.190	172.19.0.2	TLSv1.2	2040	Client Hello (SNI=api.zhongkerobot.com)
300	52.008196	172.19.0.2	36.143.177.190	TCP	54	8443 → 14264 [ACK] Seq=1 Ack=1987 Win=62336 Len=0
301	52.009913	172.19.0.2	36.143.177.190	TLSv1.2	2902	Server Hello
302	52.009941	172.19.0.2	36.143.177.190	TLSv1.2	1579	Certificate, Server Key Exchange, Server Hello Done
303	52.021973	36.143.177.190	172.19.0.2	TCP	54	14264 → 8443 [ACK] Seq=1987 Ack=2849 Win=65280 Len=0
304	52.022196	36.143.177.190	172.19.0.2	TCP	54	14264 → 8443 [ACK] Seq=1987 Ack=4374 Win=65280 Len=0
305	52.022260	36.143.177.190	172.19.0.2	TLSv1.2	147	Client Key Exchange, Change Cipher Spec, Encrypted Handshake Message
306	52.022538	172.19.0.2	36.143.177.190	TLSv1.2	280	New Session Ticket, Change Cipher Spec, Encrypted Handshake Message
307	52.034348	36.143.177.190	172.19.0.2	TLSv1.2	782	Application Data
308	52.034813	172.19.0.2	36.143.177.190	TLSv1.2	199	Application Data
309	52.094239	36.143.177.190	172.19.0.2	TCP	54	14264 → 8443 [ACK] Seq=2808 Ack=4745 Win=65024 Len=0
310	52.094263	172.19.0.2	36.143.177.190	TLSv1.2	458	Application Data, Application Data, Application Data, Application Data
311	52.106654	36.143.177.190	172.19.0.2	TCP	54	14264 → 8443 [FIN, ACK] Seq=2808 Ack=5149 Win=64512 Len=0
312	52.106935	172.19.0.2	36.143.177.190	TCP	54	8443 → 14264 [FIN, ACK] Seq=5149 Ack=2809 Win=61696 Len=0
313	52.118700	36.143.177.190	172.19.0.2	TCP	54	14264 → 8443 [ACK] Seq=2809 Ack=5150 Win=64512 Len=0
314	55.984806	36.143.177.190	172.19.0.2	TCP	66	14049 → 8443 [SYN] Seq=0 Win=65535 Len=0 MSS=1424 WS=256 SACK_PERM
315	55.984835	172.19.0.2	36.143.177.190	TCP	66	8443 → 14049 [SYN, ACK] Seq=0 Ack=1 Win=64240 Len=0 MSS=1460 SACK_PERM WS=128
316	56.000508	36.143.177.190	172.19.0.2	TCP	54	14049 → 8443 [ACK] Seq=1 Ack=1 Win=65280 Len=0
317	56.002257	36.143.177.190	172.19.0.2	TCP	1478	14049 → 8443 [ACK] Seq=1 Ack=1 Win=65280 Len=1424 [TCP PDU reassembled in 319]
318	56.002294	172.19.0.2	36.143.177.190	TCP	54	8443 → 14049 [ACK] Seq=1 Ack=1425 Win=64640 Len=0
319	56.002396	36.143.177.190	172.19.0.2	TLSv1.2	520	Client Hello (SNI=api.zhongkerobot.com)
320	56.002407	172.19.0.2	36.143.177.190	TCP	54	8443 → 14049 [ACK] Seq=1 Ack=1891 Win=65152 Len=0
321	56.003748	172.19.0.2	36.143.177.190	TLSv1.2	2902	Server Hello
322	56.003781	172.19.0.2	36.143.177.190	TLSv1.2	1579	Certificate, Server Key Exchange, Server Hello Done
323	56.019777	36.143.177.190	172.19.0.2	TCP	54	14049 → 8443 [ACK] Seq=1891 Ack=4374 Win=65280 Len=0
324	56.020869	36.143.177.190	172.19.0.2	TLSv1.2	147	Client Key Exchange, Change Cipher Spec, Encrypted Handshake Message
325	56.021197	172.19.0.2	36.143.177.190	TLSv1.2	280	New Session Ticket, Change Cipher Spec, Encrypted Handshake Message
326	56.036953	36.143.177.190	172.19.0.2	TLSv1.2	782	Application Data
327	56.037415	172.19.0.2	36.143.177.190	TLSv1.2	199	Application Data
328	56.095516	36.143.177.190	172.19.0.2	TCP	54	14049 → 8443 [ACK] Seq=2712 Ack=4745 Win=65024 Len=0
329	56.095536	172.19.0.2	36.143.177.190	TLSv1.2	458	Application Data, Application Data, Application Data, Application Data
330	56.112787	36.143.177.190	172.19.0.2	TCP	54	14049 → 8443 [FIN, ACK] Seq=2712 Ack=5149 Win=64512 Len=0
331	56.113105	172.19.0.2	36.143.177.190	TCP	54	8443 → 14049 [FIN, ACK] Seq=5149 Ack=2713 Win=65152 Len=0
332	56.128997	36.143.177.190	172.19.0.2	TCP	54	14049 → 8443 [ACK] Seq=2713 Ack=5150 Win=64512 Len=0
这是抓包数据，文件类型不给上传只能发下文件的数据了，其中

143	20.721486	172.19.0.2	36.143.177.190	DTLS	354	Client Hello
146	20.757004	172.19.0.2	36.143.177.190	DTLS	354	Client Hello
147	20.857716	172.19.0.2	36.143.177.190	DTLS	354	Client Hello
148	21.057807	172.19.0.2	36.143.177.190	DTLS	354	Client Hello
151	21.458568	172.19.0.2	36.143.177.190	DTLS	354	Client Hello
156	22.259420	172.19.0.2	36.143.177.190	DTLS	354	Client Hello
161	23.860237	172.19.0.2	36.143.177.190	DTLS	354	Client Hello
180	27.061152	172.19.0.2	36.143.177.190	DTLS	354	Client Hello
219	33.461386	172.19.0.2	36.143.177.190	DTLS	354	Client Hello
277	46.262104	172.19.0.2	36.143.177.190	DTLS	354	Client Hello
这是dtls相关的数据

I (24) boot: ESP-IDF v5.5.2 2nd stage bootloader
I (25) boot: compile time Mar  4 2026 10:59:39
I (25) boot: Multicore bootloader
I (25) boot: chip revision: v0.2
I (28) boot: efuse block revision: v1.3
I (31) boot.esp32s3: Boot SPI Speed : 80MHz
I (35) boot.esp32s3: SPI Mode       : DIO
I (39) boot.esp32s3: SPI Flash Size : 4MB
I (43) boot: Enabling RNG early entropy source...
I (47) boot: Partition Table:
I (50) boot: ## Label            Usage          Type ST Offset   Length
I (56) boot:  0 nvs              WiFi data        01 02 00009000 00006000       
I (63) boot:  1 phy_init         RF data          01 01 0000f000 00001000       
I (69) boot:  2 factory          factory app      00 00 00010000 00300000
I (76) boot: End of partition table
I (79) esp_image: segment 0: paddr=00010020 vaddr=3c200020 size=a20dch (663772) map
I (203) esp_image: segment 1: paddr=000b2104 vaddr=3fcb0100 size=08460h ( 33888) load
I (210) esp_image: segment 2: paddr=000ba56c vaddr=40378000 size=05aach ( 23212) load
I (216) esp_image: segment 3: paddr=000c0020 vaddr=42000020 size=1f8c00h (2067456) map
I (580) esp_image: segment 4: paddr=002b8c28 vaddr=4037daac size=22584h (140676) load
I (611) esp_image: segment 5: paddr=002db1b4 vaddr=50000000 size=00020h (    32) load
I (627) boot: Loaded app from partition at offset 0x10000
I (627) boot: Disabling RNG early entropy source...
W (637) flash HPM: HPM mode is optional feature that depends on flash model. Read Docs First!
W (637) flash HPM: HPM mode with DC adjustment is disabled. Some flash models may not be supported. Read Docs First!
W (644) flash HPM: High performance mode of this flash model hasn't been supported.
I (652) MSPI Timing: Enter flash timing tuning
I (656) octal_psram: vendor id    : 0x0d (AP)
I (660) octal_psram: dev id       : 0x02 (generation 3)
I (665) octal_psram: density      : 0x03 (64 Mbit)
I (669) octal_psram: good-die     : 0x01 (Pass)
I (674) octal_psram: Latency      : 0x01 (Fixed)
I (678) octal_psram: VCC          : 0x01 (3V)
I (682) octal_psram: SRF          : 0x01 (Fast Refresh)
I (687) octal_psram: BurstType    : 0x01 (Hybrid Wrap)
I (692) octal_psram: BurstLen     : 0x01 (32 Byte)
I (696) octal_psram: Readlatency  : 0x02 (10 cycles@Fixed)
I (702) octal_psram: DriveStrength: 0x00 (1/1)
I (706) MSPI Timing: Enter psram timing tuning
I (719) esp_psram: Found 8MB PSRAM device
I (719) esp_psram: Speed: 120MHz
I (719) cpu_start: Multicore app
I (954) esp_psram: SPI SRAM memory test OK
I (963) cpu_start: GPIO 44 and 43 are used as console UART I/O pins
I (963) cpu_start: Pro cpu start user code
I (963) cpu_start: cpu freq: 240000000 Hz
I (965) app_init: Application information:
I (969) app_init: Project name:     whip_demo
I (973) app_init: App version:      1
I (976) app_init: Compile time:     Mar  4 2026 09:01:45
I (981) app_init: ELF file SHA256:  74668a557...
I (986) app_init: ESP-IDF:          v5.5.2
I (989) efuse_init: Min chip rev:     v0.0
I (993) efuse_init: Max chip rev:     v0.99
I (997) efuse_init: Chip rev:         v0.2
I (1001) heap_init: Initializing. RAM available for dynamic allocation:
I (1007) heap_init: At 3FCBE6A0 len 0002B070 (172 KiB): RAM
I (1013) heap_init: At 3FCE9710 len 00005724 (21 KiB): RAM
I (1018) heap_init: At 600FE000 len 00001FE8 (7 KiB): RTCRAM
I (1023) esp_psram: Adding pool of 8192K of PSRAM memory to heap allocator
I (1030) spi_flash: detected chip: gd
I (1033) spi_flash: flash io: dio
W (1036) spi_flash: Detected size(16384k) larger than the size in the binary image header(4096k). Using the size in the binary image header.
I (1049) sleep_gpio: Configure to isolate all GPIO pins in sleep state
I (1055) sleep_gpio: Enable automatic switching of GPIO sleep configuration     
I (1062) main_task: Started on CPU0
I (1082) esp_psram: Reserving pool of 32K of internal memory for DMA/internal allocations
I (1082) main_task: Calling app_main()
I (1082) Board: Init board.
i2c: {sda: 17, scl: 18}
i2s: {mclk: 16, bclk: 9, ws: 45, din: 10, dout: 8}
out: {codec: ES8311, pa: 48, pa_gain: 6, use_mclk: 1, pa_gain: 6}
in: {codec: ES7210}
sdcard: {clk: 15, cmd: 7, d0: 4}
camera: {type: dvp, xclk: 40, pclk: 11, vsync: 21, href: 38, d0: 13, d1: 47, d2: 14, d3: 3, d4: 12, d5: 42, d6: 41, d7: 39}
lcd: {bus: spi, extend_io: tca9554, controller: st7789, spi_bus: 2, mirror_x: 1, mirror_y: 1, swap_xy: 0, color_inv: 0, width: 320, height: 240, ctrl: ext1, rst: ext2, cs: ext3, dc: 2, clk: 1, mosi: 0, cmd_bits: 8, param_bits: 8}
E (1132) i2c.master: this port has not been initialized, please initialize it first
I (1142) CODEC_INIT: Set mater handle 0 0x3c2b0b4c
I (1142) CODEC_INIT: in:1 out:1 port: 1
I (1152) CODEC_INIT: Success to int i2c: 0
I (1152) CODEC_INIT: Init i2s 0 type: 3 mclk:16 bclk:9 ws:45 din:10 dout:8      
I (1162) CODEC_INIT: tx:0x3c2b0fec rx:0x3c2b11b8
I (1162) CODEC_INIT: output init std ret 0
I (1172) CODEC_INIT: Input init std ret 0
I (1172) CODEC_INIT: Init i2s 0 ok
I (1172) CODEC_INIT: Success to init i2s: 0
I (1182) CODEC_INIT: Success to int i2c: 0
I (1182) CODEC_INIT: Success to init i2s: 0
I (1182) CODEC_INIT: Get out handle 0x3c2b0fec port 0
I (1192) ES8311: Work in Slave mode
I (1202) ES7210: Work in Slave mode
I (1212) ES7210: Enable ES7210_INPUT_MIC1
I (1212) ES7210: Enable ES7210_INPUT_MIC3
I (1222) TCA9554: Detected IO expander device at 0x70, name is: TCA9554A
I (1342) LCD_INIT: CLK 1 MOSI 0 CS:-1 DC: 2 Bus:1
I (1342) LCD_INIT: Init driver ST7789 finished
I (1442) VENC_EL: Create vid_enc-0x3c2b2010
I (1442) OVERLAY_MIXER: Create video overlay, vid_overlay-0x3c2b20dc

Type 'help' to get the list of commands.
Use UP/DOWN arrows to navigate through command history.
Press TAB when typing command name to auto-complete.
I (1582) pp: pp rom version: e7ae62f
I (1582) net80211: net80211 rom version: e7ae62f
I (1602) wifi:wifi driver task: 3fcd5de8, prio:23, stack:6656, core=0
I (1602) wifi:wifi firmware version: ee91c8c
I (1602) wifi:wifi certification version: v7.0
I (1602) wifi:config NVS flash: enabled
I (1602) wifi:config nano formatting: disabled
                                                                               I (1622) wifi:Init data frame dynamic rx buffer num: 32
I (1622) wifi:Init static rx mgmt buffer num: 5
I (1632) wifi:Init management short buffer num: 32
I (1632) wifi:Init static tx buffer num: 16
I (1632) wifi:Init tx cache buffer num: 32
I (1642) wifi:Init static tx FG buffer num: 2
I (1642) wifi:Init static rx buffer size: 1600
I (1642) wifi:Init static rx buffer num: 16
I (1652) wifi:Init dynamic rx buffer num: 32
I (1652) wifi_init: rx ba win: 16
I (1652) wifi_init: accept mbox: 6
I (1662) wifi_init: tcpip mbox: 64
I (1662) wifi_init: udp mbox: 64
I (1662) wifi_init: tcp mbox: 6
I (1662) wifi_init: tcp tx win: 5760
I (1672) wifi_init: tcp rx win: 5760
I (1672) wifi_init: tcp mss: 1440
I (1672) wifi_init: WiFi/LWIP prefer SPIRAM
I (1692) wifi_init: WiFi IRAM OP enabled
I (1692) wifi_init: WiFi RX IRAM OP enabled
I (1692) NETWORK: Force to use wifi config from nvs
esp> I (1712) wifi:Set ps type: 0, coexist: 0

I (1712) phy_init: phy_version 711,97bcf0a2,Aug 25 2025,19:04:10
I (1762) wifi:mode : sta (98:88:e0:14:0e:84)
I (1762) wifi:enable tsf
I (1762) NETWORK: wifi_init_sta finished.
I (1772) wifi:new:<6,0>, old:<1,0>, ap:<255,255>, sta:<6,0>, prof:1, snd_ch_cfg:0x0
I (1772) wifi:state: init -> auth (0xb0)
I (2062) wifi:state: auth -> init (0x600)
I (2122) wifi:new:<6,0>, old:<6,0>, ap:<255,255>, sta:<6,0>, prof:1, snd_ch_cfg:0x0
I (2122) NETWORK: retry to connect to the AP
I (4522) NETWORK: retry to connect to the AP
I (4532) wifi:new:<6,0>, old:<6,0>, ap:<255,255>, sta:<6,0>, prof:1, snd_ch_cfg:0x0
I (4532) wifi:state: init -> auth (0xb0)
I (5202) wifi:state: auth -> assoc (0x0)
I (5212) wifi:state: assoc -> run (0x10)
I (5242) wifi:connected with CMCC-zkls, aid = 12, channel 6, BW20, bssid = b4:7c:a6:22:63:6c
I (5242) wifi:security: WPA3-SAE, phy: bgn, rssi: -31
I (5272) wifi:pm start, type: 0

I (5272) wifi:dp: 1, bi: 102400, li: 3, scale listen interval from 307200 us to 307200 us
I (5272) wifi:set rx beacon pti, rx_bcn_pti: 0, bcn_timeout: 25000, mt_pti: 0, mt_time: 10000
I (5282) wifi:AP's beacon interval = 102400 us, DTIM period = 1
I (5282) wifi:<ba-add>idx:0 (ifx:0, b4:7c:a6:22:63:6c), tid:0, ssn:2, winSize:64
I (8422) esp_netif_handlers: sta ip: 192.168.10.59, mask: 255.255.255.0, gw: 192.168.10.1
I (8422) NETWORK: got ip:192.168.10.59
I (8422) webrtc_time_utils: Initializing SNTP
I (10432) webrtc_time_utils: Waiting for system time to be set... (1/5)
I (12432) webrtc_time_utils: Waiting for system time to be set... (2/5)
I (13252) TIME: Time is set: Wed Mar  4 03:31:02 2026
E (13252) webrtc: ICE info not fetched yet
I (13252) DTLS: Init SRTP OK
I (15742) webrtc: peer_connection_task started
I (15742) webrtc: PeerConnectionState: 2
I (15742) AGENT: Start agent as Controlling
Add audio codec 9 sample_rate 0
I (15752) webrtc: Send client sdp: v=0
o=- 7801614086411001801 2 IN IP4 0.0.0.0
s=-
t=0 0
a=msid-semantic: esp-webrtc
a=group:BUNDLE 0 1
m=audio 9 UDP/TLS/RTP/SAVP 111
a=rtpmap:111 opus/48000/2
a=ssrc:6 cname:webrtc-opus
a=ssrc:6 msid:esp_stream a0
a=sendrecv
a=mid:0
a=msid:esp_stream a0
c=IN IP4 0.0.0.0
a=rtcp-mux
a=fingerprint:sha-256 8A:C4:9B:7B:42:67:34:0D:BE:9E:5A:E9:CA:A5:43:70:D4:0C:31:7D:D5:37:8A:95:FE:D0:2D:70:E4:AE:52:88
a=setup:passive
a=ice-ufrag:Xd4P
a=ice-pwd:oKWwUlPd9ZwfQgpeN3WiStdY
a=candidate:0 1 UDP 2129552639 192.168.10.59 61028 typ host
m=video 9 UDP/TLS/RTP/SAVPF 102 106
a=rtpmap:102 H264/90000
a=rtcp-fb:102 goog-remb
a=rtcp-fb:102 transport-cc
a=rtcp-fb:102 ccm fir
a=rtcp-fb:102 nack
a=rtcp-fb:102 nack pli
a=fmtp:102 level-asymmetry-allowed=1
a=rtpmap:106 H264/90000
a=rtcp-fb:106 goog-remb
a=rtcp-fb:106 transport-cc
a=rtcp-fb:106 ccm fir
a=rtcp-fb:106 nack
a=rtcp-fb:106 nack pli
a=fmtp:106 level-asymmetry-allowed=1;packetization-mode=1;profile-level-id=4d001f
a=ssrc:1 cname:webrtc-h264
a=ssrc:1 msid:esp_stream v0
a=sendrecv
a=mid:1
a=msid:esp_stream v0
c=IN IP4 0.0.0.0
a=rtcp-mux
a=fingerprint:sha-256 8A:C4:9B:7B:42:67:34:0D:BE:9E:5A:E9:CA:A5:43:70:D4:0C:31:7D:D5:37:8A:95:FE:D0:2D:70:E4:AE:52:88
a=setup:passive
a=ice-ufrag:Xd4P
a=ice-pwd:oKWwUlPd9ZwfQgpeN3WiStdY
a=candidate:0 1 UDP 2129552639 192.168.10.59 61028 typ host


I (15922) wifi:<ba-add>idx:1 (ifx:0, b4:7c:a6:22:63:6c), tid:5, ssn:1, winSize:64
I (16002) esp-x509-crt-bundle: Certificate validated
Connection --> Close
Content-Type --> application/sdp
Location --> /rtc/v1/whip/?action=delete&token=o8r9l9a44&app=ygc&stream=test&session=1vm5ma94:Xd4P
Content-Length --> 1214
Server --> SRS/5.0.213(Bee)
Get remote SDP v=0
o=SRS/5.0.213(Bee) 140002648824864 2 IN IP4 0.0.0.0
s=SRSPublishSession
t=0 0
a=ice-lite
a=group:BUNDLE 0 1
a=msid-semantic: WMS ygc/test
m=audio 9 UDP/TLS/RTP/SAVPF 111
c=IN IP4 0.0.0.0
a=ice-ufrag:1vm5ma94
a=ice-pwd:8099kqo82y9656809zww9f017k979rm7
a=fingerprint:sha-256 88:98:E0:5D:7C:78:04:DD:23:19:27:F2:6F:82:72:12:8B:3A:7E:87:6D:B3:61:A7:17:42:BB:79:EF:54:A4:F6
a=setup:active
a=mid:0
a=recvonly
a=rtcp-mux
a=rtcp-rsize
a=rtpmap:111 opus/48000/2
a=candidate:0 1 udp 2130706431 172.19.0.2 8000 typ host generation 0
a=candidate:1 1 udp 2130706431 42.193.104.192 8000 typ host generation 0        
m=video 9 UDP/TLS/RTP/SAVPF 106
c=IN IP4 0.0.0.0
a=ice-ufrag:1vm5ma94
a=ice-pwd:8099kqo82y9656809zww9f017k979rm7
a=fingerprint:sha-256 88:98:E0:5D:7C:78:04:DD:23:19:27:F2:6F:82:72:12:8B:3A:7E:87:6D:B3:61:A7:17:42:BB:79:EF:54:A4:F6
a=setup:active
a=mid:1
a=recvonly
a=rtcp-mux
a=rtcp-rsize
a=rtpmap:106 H264/90000
a=rtcp-fb:106 nack
a=rtcp-fb:106 nack pli
a=fmtp:106 level-asymmetry-allowed=1;packetization-mode=1;profile-level-id=4d001f
a=candidate:0 1 udp 2130706431 172.19.0.2 8000 typ host generation 0
a=candidate:1 1 udp 2130706431 42.193.104.192 8000 typ host generation 0
4<
I (16762) HTTPS_CLIENT: HTTP Status = 201, content_length = 1214
I (16762) PEER_DEF: Get peer role 0
I (16772) PEER_DEF: Get peer role 0
I (16772) PEER_DEF: Select H264 106
I (16772) AGENT: 0 Add remote type:1 172.19.0.2:8000
I (16772) AGENT: 0 Add remote type:1 42.193.104.192:8000
I (16782) AGENT: 0 Sorted pair 0 type: 1 local:192.168.10.59:61028 Remote:172.19.0.2:8000
I (16792) AGENT: 0 Sorted pair 1 type: 1 local:192.168.10.59:61028 Remote:42.193.104.192:8000
I (16792) webrtc: PeerConnectionState: 3
I (16802) webrtc: PeerConnectionState: 3
I (16812) AGENT: 0 Send binding request (cand:0) local:192.168.10.59:61028 remote:172.19.0.2:8000 id:7043bfa4398150e937521657
I (16812) AGENT: 0 Send binding request (cand:0) local:192.168.10.59:61028 remote:42.193.104.192:8000 id:4d9a2fdb76c3625e55075020
I (16882) AGENT: 0 Select pair42.193.104.192:8000
I (16882) AGENT: 0 Send binding request (cand:1) local:192.168.10.59:61028 remote:42.193.104.192:8000 id:329b54fb381fc0385378d5a8
I (16912) AGENT: 0 Candidate responsed
I (17222) AGENT: 0 Send binding request (cand:1) local:192.168.10.59:61028 remote:42.193.104.192:8000 id:76e5004e797d87a62756c714
I (17792) AGENT: 0 Send binding request (cand:1) local:192.168.10.59:61028 remote:42.193.104.192:8000 id:4c598d93643bd7252b449456
I (18332) AGENT: 0 Send binding request (cand:1) local:192.168.10.59:61028 remote:42.193.104.192:8000 id:671286247899e644088232df
I (18762) AGENT: 0 Send binding request (cand:1) local:192.168.10.59:61028 remote:42.193.104.192:8000 id:6db505597d157d8d71dfed43
I (19302) AGENT: 0 Send binding request (cand:1) local:192.168.10.59:61028 remote:42.193.104.192:8000 id:45cb977b6ea3bbbe3a984b90
I (19672) webrtc: PeerConnectionState: 7
这是设备日志，和之前一样没变化
辛苦大佬帮忙看下

**Comment by TempoTian** [comment]
用wiresharek抓个包看看，log显示对端一直没有发binding request过来

**Comment by Yvyang-1** [comment]
嗯，是的，现在问题就是esp32设备端一直不响应，服务器一直在发数据，但是设备端没有任何反应，抓包也是只有服务器的数据，


全程都是服务器在发数据，然后设备端这是一直再发stun

**Comment by Yvyang-1** [comment]
> 用wiresharek抓个包看看，log显示对端一直没有发binding request过来

<img width="1608" height="420" alt="Image" src="https://github.com/user-attachments/assets/52fcdce0-4dd1-4a4e-ae79-315d0e0bee5d" />

**Comment by Yvyang-1** [comment]
<img width="1785" height="186" alt="Image" src="https://github.com/user-attachments/assets/6a1a1bb5-9525-4b4d-be71-5d9e3b3ec22b" />
这个是用obs推流的，直接就成了

**Comment by TempoTian** [comment]
原始包发我看下，提供下ESP32的IP信息

**Comment by Yvyang-1** [comment]
o=- 7801614086411001801 2 IN IP4 0.0.0.0
s=-
t=0 0
a=msid-semantic: esp-webrtc
a=group:BUNDLE 0 1
m=audio 9 UDP/TLS/RTP/SAVP 111
a=rtpmap:111 opus/48000/2
a=ssrc:6 cname:webrtc-opus
a=ssrc:6 msid:esp_stream a0
a=sendrecv
a=mid:0
a=msid:esp_stream a0
c=IN IP4 0.0.0.0
a=rtcp-mux
a=fingerprint:sha-256 70:7F:53:30:EE:09:13:DF:C9:02:82:26:9E:06:DF:C4:90:E2:E8:3F:21:9D:79:FE:BC:DC:3C:A1:14:5F:6F:2E
a=setup:passive
a=ice-ufrag:Xd4P
a=ice-pwd:oKWwUlPd9ZwfQgpeN3WiStdY
a=candidate:0 1 UDP 2127668223 192.168.10.59 53667 typ host
m=video 9 UDP/TLS/RTP/SAVPF 102 106
a=rtpmap:102 H264/90000
a=rtcp-fb:102 goog-remb
a=rtcp-fb:102 transport-cc
a=rtcp-fb:102 ccm fir
a=rtcp-fb:102 nack
a=rtcp-fb:102 nack pli
a=fmtp:102 level-asymmetry-allowed=1
a=rtpmap:106 H264/90000
a=rtcp-fb:106 goog-remb
a=rtcp-fb:106 transport-cc
a=rtcp-fb:106 ccm fir
a=rtcp-fb:106 nack
a=rtcp-fb:106 nack pli
a=fmtp:106 level-asymmetry-allowed=1;packetization-mode=1;profile-level-id=4d001f
a=ssrc:1 cname:webrtc-h264
a=ssrc:1 msid:esp_stream v0
a=sendrecv
a=mid:1
a=msid:esp_stream v0
c=IN IP4 0.0.0.0
a=rtcp-mux
a=fingerprint:sha-256 70:7F:53:30:EE:09:13:DF:C9:02:82:26:9E:06:DF:C4:90:E2:E8:3F:21:9D:79:FE:BC:DC:3C:A1:14:5F:6F:2E
a=setup:passive
a=ice-ufrag:Xd4P
a=ice-pwd:oKWwUlPd9ZwfQgpeN3WiStdY
a=candidate:0 1 UDP 2127668223 192.168.10.59 53667 typ host
这是设备的sdp信息
ESP32 局域网 IP (Local IP): 192.168.10.59
子网掩码 (Netmask): 255.255.255.0 (/24)
网关 (Gateway): 192.168.10.1
Wi-Fi MAC 地址: 98:88:e0:14:0e:84
本地 UDP 端口: 53667

**Comment by Yvyang-1** [comment]
1	0.000000	36.143.177.190	172.19.0.2	TCP	58	14261 → 8443 [SYN] Seq=0 Win=5760 Len=0 MSS=1424
2	0.000029	172.19.0.2	36.143.177.190	TCP	58	8443 → 14261 [SYN, ACK] Seq=0 Ack=1 Win=64240 Len=0 MSS=1460
3	0.021739	36.143.177.190	172.19.0.2	TCP	54	14261 → 8443 [ACK] Seq=1 Ack=1 Win=5760 Len=0
4	0.025100	36.143.177.190	172.19.0.2	TLSv1.2	307	Client Hello (SNI=api.zhongkerobot.com)
5	0.025124	172.19.0.2	36.143.177.190	TCP	54	8443 → 14261 [ACK] Seq=1 Ack=254 Win=63987 Len=0
6	0.026526	172.19.0.2	36.143.177.190	TLSv1.2	2902	Server Hello
7	0.026564	172.19.0.2	36.143.177.190	TLSv1.2	1579	Certificate, Server Key Exchange, Server Hello Done
8	0.044424	36.143.177.190	172.19.0.2	TCP	54	14261 → 8443 [ACK] Seq=254 Ack=2849 Win=2912 Len=0
9	0.045151	36.143.177.190	172.19.0.2	TCP	54	14261 → 8443 [ACK] Seq=254 Ack=4374 Win=1387 Len=0
10	0.045357	36.143.177.190	172.19.0.2	TCP	54	[TCP Window Update] 14261 → 8443 [ACK] Seq=254 Ack=4374 Win=5446 Len=0
11	0.297086	36.143.177.190	172.19.0.2	TLSv1.2	96	Client Key Exchange
12	0.338132	172.19.0.2	36.143.177.190	TCP	54	8443 → 14261 [ACK] Seq=4374 Ack=296 Win=63987 Len=0
13	0.356356	36.143.177.190	172.19.0.2	TLSv1.2	105	Change Cipher Spec, Encrypted Handshake Message
14	0.356383	172.19.0.2	36.143.177.190	TCP	54	8443 → 14261 [ACK] Seq=4374 Ack=347 Win=63987 Len=0
15	0.356589	172.19.0.2	36.143.177.190	TLSv1.2	280	New Session Ticket, Change Cipher Spec, Encrypted Handshake Message
16	0.375058	36.143.177.190	172.19.0.2	TLSv1.2	277	Application Data
17	0.415140	172.19.0.2	36.143.177.190	TCP	54	8443 → 14261 [ACK] Seq=4600 Ack=570 Win=63987 Len=0
18	0.430593	36.143.177.190	172.19.0.2	TLSv1.2	1460	Application Data
19	0.430615	172.19.0.2	36.143.177.190	TCP	54	8443 → 14261 [ACK] Seq=4600 Ack=1976 Win=63270 Len=0
20	0.467100	172.19.0.2	36.143.177.190	TLSv1.2	302	Application Data
21	0.492701	36.143.177.190	172.19.0.2	TCP	54	14261 → 8443 [ACK] Seq=1976 Ack=4848 Win=4972 Len=0
22	0.492720	172.19.0.2	36.143.177.190	TLSv1.2	1297	Application Data
23	0.515895	36.143.177.190	172.19.0.2	TCP	54	14261 → 8443 [ACK] Seq=1976 Ack=6091 Win=5760 Len=0
24	0.622743	36.143.177.190	172.19.0.2	TCP	54	14261 → 8443 [FIN, ACK] Seq=1976 Ack=6091 Win=5760 Len=0
25	0.623016	172.19.0.2	36.143.177.190	TCP	54	8443 → 14261 [FIN, ACK] Seq=6091 Ack=1977 Win=63270 Len=0
26	0.640565	36.143.177.190	172.19.0.2	TCP	54	14261 → 8443 [ACK] Seq=1977 Ack=6092 Win=5759 Len=0
27	0.692884	36.143.177.190	172.19.0.2	STUN	126	Binding Request user: 4p14964f:Xd4P
28	0.708329	172.19.0.2	36.143.177.190	STUN	126	Binding Success Response user: 4p14964f:Xd4P XOR-MAPPED-ADDRESS: 36.143.177.190:14099
29	0.708469	172.19.0.2	36.143.177.190	DTLS	354	Client Hello
30	0.739920	36.143.177.190	172.19.0.2	STUN	138	Binding Request user: 4p14964f:Xd4P
31	0.740103	172.19.0.2	36.143.177.190	STUN	126	Binding Success Response user: 4p14964f:Xd4P XOR-MAPPED-ADDRESS: 36.143.177.190:14099
32	0.758569	172.19.0.2	36.143.177.190	DTLS	354	Client Hello
33	0.858938	172.19.0.2	36.143.177.190	DTLS	354	Client Hello
34	1.059235	172.19.0.2	36.143.177.190	DTLS	354	Client Hello
35	1.089531	36.143.177.190	172.19.0.2	STUN	138	Binding Request user: 4p14964f:Xd4P
36	1.089688	172.19.0.2	36.143.177.190	STUN	126	Binding Success Response user: 4p14964f:Xd4P XOR-MAPPED-ADDRESS: 36.143.177.190:14099
37	1.459258	172.19.0.2	36.143.177.190	DTLS	354	Client Hello
38	1.659746	36.143.177.190	172.19.0.2	STUN	138	Binding Request user: 4p14964f:Xd4P
39	1.659885	172.19.0.2	36.143.177.190	STUN	126	Binding Success Response user: 4p14964f:Xd4P XOR-MAPPED-ADDRESS: 36.143.177.190:14099
40	2.199554	36.143.177.190	172.19.0.2	STUN	138	Binding Request user: 4p14964f:Xd4P
41	2.201220	172.19.0.2	36.143.177.190	STUN	126	Binding Success Response user: 4p14964f:Xd4P XOR-MAPPED-ADDRESS: 36.143.177.190:14099
42	2.259428	172.19.0.2	36.143.177.190	DTLS	354	Client Hello
43	2.639623	36.143.177.190	172.19.0.2	STUN	138	Binding Request user: 4p14964f:Xd4P
44	2.639745	172.19.0.2	36.143.177.190	STUN	126	Binding Success Response user: 4p14964f:Xd4P XOR-MAPPED-ADDRESS: 36.143.177.190:14099
45	3.859991	172.19.0.2	36.143.177.190	DTLS	354	Client Hello
46	7.060639	172.19.0.2	36.143.177.190	DTLS	354	Client Hello
47	13.461454	172.19.0.2	36.143.177.190	DTLS	354	Client Hello
48	26.261668	172.19.0.2	36.143.177.190	DTLS	354	Client Hello
这是抓包数据，文件发不了

**Comment by TempoTian** [comment]
从抓包看server确实没发binding消息过来, 比较像是ICE lite的server 要兼容这个server需要我加个配置

**Comment by Yvyang-1** [comment]
嗯，是的，现在主要就是esp32s3设备端不响应的问题，要改什么东西嘛？

**Comment by Yvyang-1** [comment]
因为我看他dtls处理都在那个esp_peer里的那个.a编译文件里，不知道怎么解决了，就是卡在这里卡快一个星期了

**Comment by TempoTian** [comment]
用的最新的版本吗，我来给你编译一个库让用lite的来测试下看啊

**Comment by Yvyang-1** [comment]
嗯，我新旧版本都试过，都一样的问题，都是设备不响应服务器的数据包

**Comment by TempoTian** [comment]
用下面的lib和头文件试一下，替换到esp_peer的include和lib/esp32s3目录：

[esp_peer_ice_lite_support.zip](https://github.com/user-attachments/files/25790917/esp_peer_ice_lite_support.zip)

**Comment by Yvyang-1** [comment]
还是一样的问题，只不过现在状态码直接变成8，直接失败了，其他的抓包、服务器日志都和之前一样，还是设备端有问题不响应

**Comment by TempoTian** [comment]
log发我看下

**Comment by Yvyang-1** [comment]
额，下班了，开发板没带，下周吧

**Comment by Yvyang-1** [comment]
[服务器日志.txt](https://github.com/user-attachments/files/25829685/default.txt)

[服务器抓包数据.txt](https://github.com/user-attachments/files/25829687/default.txt)

[esp32设备日志.txt](https://github.com/user-attachments/files/25829700/esp32.txt)
这是

> log发我看下
这些是替换了.a文件后的日志输出，感觉和之前一样，还是设备端无响应，DTLS握手没有完成

**Comment by TempoTian** [comment]
忘了说了我加了一个配置，要设置为true才行
```
 bool                          ice_use_lite_mode;    /**< Enable ICE Lite mode (simplified ICE for always-on servers) */
```
正常会有下面的log

<img width="769" height="158" alt="Image" src="https://github.com/user-attachments/assets/349b8cfe-db2a-4857-8890-15500cf21ff7" />

**Comment by Yvyang-1** [comment]
> 忘了说了我加了一个配置，要设置为true才行
> 
> ```
>  bool                          ice_use_lite_mode;    /**< Enable ICE Lite mode (simplified ICE for always-on servers) */
> ```
> 
> 正常会有下面的log
> 
> <img alt="Image" width="769" height="158" src="https://private-user-images.githubusercontent.com/110106787/560015318-349b8cfe-db2a-4857-8890-15500cf21ff7.png?jwt=eyJ0eXAiOiJKV1QiLCJhbGciOiJIUzI1NiJ9.eyJpc3MiOiJnaXRodWIuY29tIiwiYXVkIjoicmF3LmdpdGh1YnVzZXJjb250ZW50LmNvbSIsImtleSI6ImtleTUiLCJleHAiOjE3NzMwMjI2ODAsIm5iZiI6MTc3MzAyMjM4MCwicGF0aCI6Ii8xMTAxMDY3ODcvNTYwMDE1MzE4LTM0OWI4Y2ZlLWRiMmEtNDg1Ny04ODkwLTE1NTAwY2YyMWZmNy5wbmc_WC1BbXotQWxnb3JpdGhtPUFXUzQtSE1BQy1TSEEyNTYmWC1BbXotQ3JlZGVudGlhbD1BS0lBVkNPRFlMU0E1M1BRSzRaQSUyRjIwMjYwMzA5JTJGdXMtZWFzdC0xJTJGczMlMkZhd3M0X3JlcXVlc3QmWC1BbXotRGF0ZT0yMDI2MDMwOVQwMjEzMDBaJlgtQW16LUV4cGlyZXM9MzAwJlgtQW16LVNpZ25hdHVyZT0yNGY4ZmRlYmQwNjQwYmQ0ODE2MWNjNjhlNWZmNTdkMDQ2MGI4YmQ3YzMwZGZkOTFmNDZjYTM0ODkzODNlODYwJlgtQW16LVNpZ25lZEhlYWRlcnM9aG9zdCJ9.57AGOrGLgRYyFbpxPZIpyPxrJ7vIyyr2kj_75217K1g">

这部分在哪呀？我没找到，全局搜也没找到，配置文件也没看到这个配置呀

**Comment by TempoTian** [comment]
这个https://github.com/user-attachments/files/25790917/esp_peer_ice_lite_support.zip 版本里面我提供了一个了，头文件里面就有，你是用的esp_peer还是esp_webrtc的API啊， 都到esp_peer_open/esp_webrtc_open的AP，I然后带上就测试下

**Comment by Yvyang-1** [comment]
<img width="813" height="277" alt="Image" src="https://github.com/user-attachments/assets/88267e11-ad12-45f2-9524-5b0500b13008" />这个日志没找到，但是

<img width="829" height="293" alt="Image" src="https://github.com/user-attachments/assets/32d5b2e9-6674-4207-be6f-8f88982cc02b" />这个日志找到了
然后您发的那两个文件我都替换到components/web_peer中了

**Comment by Yvyang-1** [comment]
> 这个https://github.com/user-attachments/files/25790917/esp_peer_ice_lite_support.zip 版本里面我提供了一个了，头文件里面就有，你是用的esp_peer还是esp_webrtc的API啊， 都到esp_peer_open/esp_webrtc_open的AP，I然后带上就测试下

然后前面的那个配置ice_use_lite_mode是您在头文件中配置好了吗？那两个文件我已经替换了

**Comment by TempoTian** [comment]
需要你手动配置下，我在lib里面没有配置，你需要搜索esp_peer_open esp_webrtc_open然后把配置设置进去

**Comment by Yvyang-1** [comment]
[esp32设备日志.txt](https://github.com/user-attachments/files/25831316/esp32.txt)
这是改完后的设备日志，是不是我改错了

[修改内容.txt](https://github.com/user-attachments/files/25831331/default.txt)
这是修改后的两个函数

> 需要你手动配置下，我在lib里面没有配置，你需要搜索esp_peer_open esp_webrtc_open然后把配置设置进去

我还看了下服务器的日志，还是和之前一样，DTLS链接超时

**Comment by TempoTian** [comment]
你用的是哪一个？如果你手动调用的esp_peer_open需要在你手动调用的地方改。

**Comment by Yvyang-1** [comment]
是问我用的历程吗？我用的是whip_demo这个历程呀。还是问这两个函数的调用？函数的话我看历程里只在webrtc.c中调用了esp_webrtc_open这个函数，esp_peer_open这个函数没见历程中用到

> 你用的是哪一个？如果你手动调用的esp_peer_open需要在你手动调用的地方改。

**Comment by Yvyang-1** [comment]
然后我是将ice_use_lite_mode这个配置加在这两个函数esp_peer_open esp_webrtc_open的实现里了

**Comment by TempoTian** [comment]
这样, 可行的话你把你的代码发我邮箱下tianhaibo@espressif.com 我来帮你debug看看。目前逻辑上有点对不上，如果配置了上面贴的log会进到下面就connect上了

**Comment by Yvyang-1** [comment]
> 这样, 可行的话你把你的代码发我邮箱下[tianhaibo@espressif.com](mailto:tianhaibo@espressif.com) 我来帮你debug看看。目前逻辑上有点对不上，如果配置了上面贴的log会进到下面就connect上了
嗯，我刚刚发给你了，代码我放附件里了。

<img width="820" height="225" alt="Image" src="https://github.com/user-attachments/assets/ba4301dd-ea90-41b2-b85b-23611bc0d546" />

**Comment by Yvyang-1** [comment]
额，我刚刚又发了一个邮件，之前发的是没替换的工程，发错了。现在发的是esp_peer/include,lib/s3中的两个文件都替换了，在esp_webrtc_open、esp_peer_open中也加上了ice_use_lite_mode这个配置。

> 这样, 可行的话你把你的代码发我邮箱下[tianhaibo@espressif.com](mailto:tianhaibo@espressif.com) 我来帮你debug看看。目前逻辑上有点对不上，如果配置了上面贴的log会进到下面就connect上了

**Comment by TempoTian** [comment]
我测试了下是可以work的，现在我正在推流你拉下看是否正常，另外也可以提供下拉流路径

<img width="1515" height="458" alt="Image" src="https://github.com/user-attachments/assets/29b77dbc-4208-455a-94ce-6f7ee46e935e" />

**Comment by Yvyang-1** [comment]
嗯，好的
[https://api.zhongkerobot.com:8443/rtc/v1/whep/?app=ygc&stream=test](https://api.zhongkerobot.com:8443/rtc/v1/whip/?app=live&stream=test)
这是拉流地址


> 我测试了下是可以work的，现在我正在推流你拉下看是否正常，另外也可以提供下拉流路径
> 
> <img alt="Image" width="1515" height="458" src="https://private-user-images.githubusercontent.com/110106787/560697679-29b77dbc-4208-455a-94ce-6f7ee46e935e.png?jwt=eyJ0eXAiOiJKV1QiLCJhbGciOiJIUzI1NiJ9.eyJpc3MiOiJnaXRodWIuY29tIiwiYXVkIjoicmF3LmdpdGh1YnVzZXJjb250ZW50LmNvbSIsImtleSI6ImtleTUiLCJleHAiOjE3NzMxMTgxMjksIm5iZiI6MTc3MzExNzgyOSwicGF0aCI6Ii8xMTAxMDY3ODcvNTYwNjk3Njc5LTI5Yjc3ZGJjLTQyMDgtNDU1YS05NGNlLTZmN2VlNDZlOTM1ZS5wbmc_WC1BbXotQWxnb3JpdGhtPUFXUzQtSE1BQy1TSEEyNTYmWC1BbXotQ3JlZGVudGlhbD1BS0lBVkNPRFlMU0E1M1BRSzRaQSUyRjIwMjYwMzEwJTJGdXMtZWFzdC0xJTJGczMlMkZhd3M0X3JlcXVlc3QmWC1BbXotRGF0ZT0yMDI2MDMxMFQwNDQzNDlaJlgtQW16LUV4cGlyZXM9MzAwJlgtQW16LVNpZ25hdHVyZT1jZmY1ZWNjM2RjMzJmYjViOWFmYTZjZTM3NTBmODRkNTgzN2Q3NjU4NTU4MzUyNGU4YzYxOWFjNDRiNzU5MjNhJlgtQW16LVNpZ25lZEhlYWRlcnM9aG9zdCJ9.zVu5xVlC45IpE2Z386LKlPlDKEZknTVc7JjbmGGxFyQ">

**Comment by Yvyang-1** [comment]
所以是设备问题嘛？还是说代码哪里有问题呀？

**Comment by TempoTian** [comment]
我没修改什么只是加了下面的地方 (如果拉流OK的话我可以推一个版本你就可以直接测试了):
```
 esp_peer_signaling_whip_cfg_t whip_cfg = {
        .auth_type = ESP_PEER_SIGNALING_WHIP_AUTH_TYPE_BASIC,
        .token = token,
    };
    esp_webrtc_cfg_t cfg = {
        .peer_cfg = {
            .audio_info = {
                .codec = ESP_PEER_AUDIO_CODEC_OPUS,
            },
            .video_info = {
                .codec = ESP_PEER_VIDEO_CODEC_H264,
                .width = VIDEO_WIDTH,
                .height = VIDEO_HEIGHT,
                .fps = VIDEO_FPS,
            },
            .audio_dir = ESP_PEER_MEDIA_DIR_SEND_ONLY,
            .video_dir = ESP_PEER_MEDIA_DIR_SEND_ONLY,
            .no_auto_reconnect = true, // No auto connect peer when signaling connected
            .extra_cfg = &peer_cfg,
            .extra_size = sizeof(peer_cfg),
        },
        .signaling_cfg = {
            .signal_url = url,
            .extra_cfg = token ? &whip_cfg : NULL,
            .extra_size = token ? sizeof(whip_cfg) : 0,
        },
        .peer_impl = esp_peer_get_default_impl(),
        .signaling_impl = esp_signaling_get_whip_impl(),
    };
```
在settings.h里面定义了下opus
```
#define WEBRTC_SUPPORT_OPUS
```

**Comment by Yvyang-1** [comment]
嗯，可以的，拉流没有问题

> 我没修改什么只是加了下面的地方 (如果拉流OK的话我可以推一个版本你就可以直接测试了):
> 
> ```
>  esp_peer_signaling_whip_cfg_t whip_cfg = {
>         .auth_type = ESP_PEER_SIGNALING_WHIP_AUTH_TYPE_BASIC,
>         .token = token,
>     };
>     esp_webrtc_cfg_t cfg = {
>         .peer_cfg = {
>             .audio_info = {
>                 .codec = ESP_PEER_AUDIO_CODEC_OPUS,
>             },
>             .video_info = {
>                 .codec = ESP_PEER_VIDEO_CODEC_H264,
>                 .width = VIDEO_WIDTH,
>                 .height = VIDEO_HEIGHT,
>                 .fps = VIDEO_FPS,
>             },
>             .audio_dir = ESP_PEER_MEDIA_DIR_SEND_ONLY,
>             .video_dir = ESP_PEER_MEDIA_DIR_SEND_ONLY,
>             .no_auto_reconnect = true, // No auto connect peer when signaling connected
>             .extra_cfg = &peer_cfg,
>             .extra_size = sizeof(peer_cfg),
>         },
>         .signaling_cfg = {
>             .signal_url = url,
>             .extra_cfg = token ? &whip_cfg : NULL,
>             .extra_size = token ? sizeof(whip_cfg) : 0,
>         },
>         .peer_impl = esp_peer_get_default_impl(),
>         .signaling_impl = esp_signaling_get_whip_impl(),
>     };
> ```
> 
> 在settings.h里面定义了下opus
> 
> ```
> #define WEBRTC_SUPPORT_OPUS
> ```

**Comment by Yvyang-1** [comment]
为什么我这照着改是这样的？

[esp32设备日志.txt](https://github.com/user-attachments/files/25860015/esp32.txt)


> 我没修改什么只是加了下面的地方 (如果拉流OK的话我可以推一个版本你就可以直接测试了):
> 
> ```
>  esp_peer_signaling_whip_cfg_t whip_cfg = {
>         .auth_type = ESP_PEER_SIGNALING_WHIP_AUTH_TYPE_BASIC,
>         .token = token,
>     };
>     esp_webrtc_cfg_t cfg = {
>         .peer_cfg = {
>             .audio_info = {
>                 .codec = ESP_PEER_AUDIO_CODEC_OPUS,
>             },
>             .video_info = {
>                 .codec = ESP_PEER_VIDEO_CODEC_H264,
>                 .width = VIDEO_WIDTH,
>                 .height = VIDEO_HEIGHT,
>                 .fps = VIDEO_FPS,
>             },
>             .audio_dir = ESP_PEER_MEDIA_DIR_SEND_ONLY,
>             .video_dir = ESP_PEER_MEDIA_DIR_SEND_ONLY,
>             .no_auto_reconnect = true, // No auto connect peer when signaling connected
>             .extra_cfg = &peer_cfg,
>             .extra_size = sizeof(peer_cfg),
>         },
>         .signaling_cfg = {
>             .signal_url = url,
>             .extra_cfg = token ? &whip_cfg : NULL,
>             .extra_size = token ? sizeof(whip_cfg) : 0,
>         },
>         .peer_impl = esp_peer_get_default_impl(),
>         .signaling_impl = esp_signaling_get_whip_impl(),
>     };
> ```
> 
> 在settings.h里面定义了下opus
> 
> ```
> #define WEBRTC_SUPPORT_OPUS
> ```

**Comment by TempoTian** [comment]
我换了下esp32s3也没啥问题，我来推一版代码，推好你再拉一下测试下看

**Comment by Yvyang-1** [comment]
<img width="1858" height="142" alt="Image" src="https://github.com/user-attachments/assets/e2a65c7e-6159-40c8-b9c9-70fcab58ab72" />
嗯，可以的，没啥问题

> 我换了下esp32s3也没啥问题，我来推一版代码，推好你再拉一下测试下看

**Comment by Yvyang-1** [comment]
嗯，我这边也收到视频流了

**Comment by Yvyang-1** [comment]
是只在setting中加#define WEBRTC_SUPPORT_OPUS这个宏，然后在webrtc.c中的结构体中把ice_use_lite_mode设为true就行吗？为什么我这还是和之前一样是访问错误内存呀

> 我换了下esp32s3也没啥问题，我来推一版代码，推好你再拉一下测试下看

**Comment by Yvyang-1** [comment]
为什么我一把ice_use_lite_mode设为true就会访问错误内存，删掉就是和之前一样的链接失败了

**Comment by TempoTian** [comment]
我把相关的代码都提交了你拉下测试下看

**Comment by Yvyang-1** [comment]
好的

**Comment by Yvyang-1** [comment]
好了，解决了，可以正常推流拉流了
